,address,mapx,mapy,name
1815,,,,충청북도 보은군 보은산업단지 기업지원시설
1816,경상남도 창원시 의창구 동읍 본포리 456,458758,306841,경상남도 창원시 가곡경로당
1817,강원도 춘천시 후평동 244-40,377908,587521,강원도 춘천시 강원디자인진흥원
1818,경기도 화성시 송산동 148-6,312767,512416,경기도 화성시 송산1유치원
1819,,,,충청남도 예산군 함께하는 실버키즈 100세 공동체 활성화 사업
1820,강원도 원주시 태장동  1052-1,395945,531165,강원도 원주시 원주시 노인종합복지관 문막분관
1821,,,,경상남도 함양군 지곡면 다목적체육관 건립사업
1822,,,,서울특별시 양천구 갈산문화복합시설
1823,,,,경기도 평택시 평택경찰서 송탄파출소
1824,,,,서울특별시 도봉구 서울북부광역등기소
1825,,,,경기도 화성시 (가칭)병점1초등학교
1826,,,,경기도 화성시 (가칭)동탄20유치원
1827,서울특별시 종로구 창성동 117-6,309484,553553,서울특별시 종로구 정부 서울청사 창성동별관
1828,광주광역시 광산구 월곡동 680-2,291732,287381,광주광역시 광산구 광산경찰서 월곡지구대
1829,,,,경상북도 울진군 울진군 농어촌놀이터
1830,대구광역시 수성구 파동 495,456151,356806,대구광역시 수성구 파동우체국
1831,,,,울산광역시 울주군 발효아케데미관
1832,,,,경기도 오산시 경기 아이드림 오산센터
1833,,,,부산광역시 중구 자갈치글로벌수산명소화
1834,전라남도 보성군 보성읍 주봉리 418-1,315225,241057,전라남도 보성군 동화나라어린이집
1835,,,,경기도 남양주시 (가칭)진건3유치원
1836,,,,경상남도 창원시 원계근린공원 내 화장실
1837,,,,전라남도 화순군 화순 동복 연둔리 숲정이 화장실
1838,경상북도 상주시 무양동 164-23,414062,424461,경상북도 상주시 상주시 육아종합지원센터
1839,경상남도 김해시 장유동 844,475206,285953,경상남도 김해시 김해서부경찰서 율하파출소
1840,,,,인천광역시 연수구 인천대학교 송도신캠퍼스 도서관(IT도서관) 증축
1841,,,,경기도 고양시 고양경찰서 도래울파출소
1842,,,,인천광역시 옹진군 연평면 주민체육시설
1843,,,,강원도 강릉시 강릉소방서 공동 직장어린이집
1844,,,,경상남도 통영시 경상남도 수산물안전관리센터
1845,,,,강원도 평창군 현충탑 화장실
1846,부산광역시 동구 범일동 1405-1,495863,282612,부산광역시 동구 동구 만화체험관
1847,,,,대구광역시 수성구 수성구 중동 치안센터
1848,,,,충청남도 홍성군 옥암어린이공원 공중화장실
1849,제주특별자치도 제주시 한경면 저지리 1843-2,237845,83367,제주특별자치도 제주시 올레14코스 안내소
1850,,,,전라북도 군산시 전주출입국관리사무소 군산출장소 신축공사
1851,,,,제주특별자치도 서귀포시 대포항 공중화장실
1852,울산광역시 북구 화봉동 1485-1,523792,333995,울산광역시 북구 고헌중학교
1853,울산광역시 중구 학성동 139-2,521469,329049,울산광역시 중구 동백시니어센터
1854,인천광역시 부평구 십정동 324-1,284808,542240,인천광역시 부평구 부평구 십정동 어린이집
1855,,,,서울특별시 구로구 신안산선 복선전철 민간투자사업(구로디지털단지 정거장)
1856,,,,서울특별시 영등포구 신안산선 복선전철 민간투자사업(영등포 정거장)
1857,,,,서울특별시 영등포구 신안산선 복선전철 민간투자사업(신풍 정거장)
1858,,,,서울특별시 영등포구 신안산선 복선전철 민간투자사업(여의도 정거장)
1859,경기도 파주시 야당동 1087,290989,568669,경기도 파주시 야당역 환승주차장
1860,강원도 인제군 상남면 상남리 1509-4,421459,582563,강원도 인제군 상남3리 경로당
1861,,,,제주특별자치도 제주시 금능리 복합문화복지센터
1862,광주광역시 북구 월출동  987,297141,293978,광주광역시 북구 헬스케어로봇실증센터
1863,,,,서울특별시 동대문구 서울시립대 미래융합관
1864,,,,대구광역시 남구 대구대표도서관
1865,,,,서울특별시 은평구 제2남도학숙
1866,,,,강원도 고성군 봉포리 아름다운 해풍거리 조성사업(관리사무소)
1867,경기도 연천군 전곡읍 전곡리 328-40,318865,602945,경기도 연천군 연천경찰서 전곡파출소
1868,,,,전라북도 장수군 호덕 마을만들기사업
1869,,,,강원도 삼척시 성내지구 대학로 주차타워
1870,충청북도 충주시 주덕읍 화곡리 1107,383285,490207,충청북도 충주시 충청강원 119특수구조대
1871,,,,전라남도 여수시 여수신북항 관리사무실 및 운영사무실
1872,,,,전라남도 완도군 해양기후 치유센터
1873,,,,경기도 안산시 신안산선 복선전철 민간투자사업(성포정거장)
1874,경상남도 산청군 삼장면 평촌리 658,383564,305735,경상남도 산청군 지리산국립공원 삼장분소
1875,,,,제주특별자치도 서귀포시 서귀포 치유의숲 내 임산물판매장 및 야외화장실
1876,,,,제주특별자치도 제주시 강구리새마을회 경로당
1877,,,,충청남도 금산군 금산 상리지구 공영주차타워
1878,경기도 광명시 일직동 527,301402,535017,경기도 광명시 빛가온중학교
1879,,,,전라남도 나주시 영강동 어울림센터 건립공사
1880,,,,경상북도 영덕군 영덕목재문화체험장 조성사업 창포말 색동나무누리 신축공사
1881,,,,전라남도 화순군 국제규격 천연물의약품원료 대량생산시설
1882,경기도 화성시 산척동 726,321200,508019,경기도 화성시 화성시 동탄호수공원 어울림센터
1883,부산광역시 금정구 구서동 83-3,499684,294804,부산광역시 금정구 금정문화원
1884,,,,경기도 화성시 서해선 복선전철 105역사
1885,,,,경기도 화성시 서해선 복선전철 104역사
1886,,,,경기도 평택시 서해선 복선전철 103역사
1887,,,,충청남도 당진시 서해선 복선전철 101역사
1888,,,,전라북도 부안군 부안군 보안면 청사 신축공사
1889,경상남도 창원시 마산합포구 월영동 602-48,450821,286634,경상남도 창원시 월영 경로당
1890,,,,충청남도 아산시 제12호 근린공원 관리사무소
1891,,,,경상남도 창원시 내서문화의집 별관
1892,,,,충청남도 아산시 제10호 근린공원 관리사무소
1893,,,,서울특별시 광진구 군자동 복합청사 건립
1894,,,,"전라남도 담양군 전라남도 1000년! 새로운 시작, 순담 Meta-Circle 프로젝트"
1895,대구광역시 중구 수창동 29-1,453422,364063,대구광역시 중구 대구행복기숙사
1896,,,,경상북도 상주시 모서면 연화사 공중화장실
1897,,,,경상북도 포항시 이동 제4공원 공영주차장
1898,,,,제주특별자치도 서귀포시 서귀포 사려니 숲 내 야외(포세식)화장실
1899,,,,제주특별자치도 제주시 삼양동 선사유적지 주차장 관리사무소
1900,충청남도 청양군 청양읍 교월리 106-1,293615,428419,충청남도 청양군 청양군 장애인회관
1901,경기도 남양주시 다산동 6236,327117,555565,경기도 남양주시 다산한강초등학교
1902,,,,경상북도 성주군 성주군 청년창업 LAB 조성사업
1903,경기도 안산시 단원구 초지동 667,295456,525327,경기도 안산시 안산산업역사박물관
1904,울산광역시 북구 연암동 1120-3,523552,332536,울산광역시 북구 육아종합지원센터
1905,경기도 수원시 장안구 정자동 43-17,311324,521653,경기도 수원시 정자동 장애인주간보호시설
1906,경기도 시흥시 조남동 683,298986,530631,경기도 시흥시 목감고등학교
1907,경기도 안양시 만안구 안양동 88-1,304843,533777,경기도 안양시 안양만안경찰서 안양지구대
1908,,,,충청북도 청주시 세종대왕 행궁
1909,강원도 철원군 갈말읍 군탄리 1382-6,339095,617537,강원도 철원군 철원국민체육센터
1910,,,,경상남도 밀양시 영남알프스 생태관광센터
1911,,,,부산광역시 동래구 (가칭)온천2초등학교
1912,,,,경기도 수원시 씽씽어린이공원 화장실
1913,서울특별시 서초구 방배동 906-5,311482,542965,서울특별시 서초구 방배1파출소
1914,,,,전라남도 여수시 양지바름공원 화장실 신축사업
1915,,,,전라남도 여수시 차동공원 화장실 신축사업
1916,,,,경기도 광명시 신안산선 복선전철 민간투자사업(광명정거장)
1917,,,,경기도 안산시 신안산선 복선전철 민간투자사업(호수정거장)
1918,,,,경기도 안산시 신안산선 복선전철 민간투자사업(한양대정거장)
1919,광주광역시 광산구 우산동 1602-2,291448,285108,광주광역시 남구 119소방안전교육센터
1920,경상남도 산청군 신안면 하정리 930-1,397567,300248,경상남도 산청군 남부문화체육센터
1921,경상남도 사천시 사천읍 평화리 51,408207,276046,경상남도 사천시 사천파출소
1922,전라북도 완주군 용진읍 용흥리 860,324019,364819,전라북도 완주군 용진읍 행정복지센터
1923,경상남도 김해시 관동동 1052-1,473535,286766,경상남도 김해시 경남콘텐츠 기업육성센터
1924,서울특별시 동작구 상도동 437,307627,544513,서울특별시 동작구 상도제4동주민센터
1925,,,,경상북도 칠곡군 칠곡군 중증장애인자립지원센터 · 가족지원센터
1926,경기도 김포시 고촌읍 신곡리 1103,291856,556623,경기도 김포시 고촌 노을주차장
1927,,,,경상북도 포항시 포항북부경찰서 양학파출소
1928,경상북도 영덕군 영덕읍 남석리 6,523079,424198,경상북도 영덕군 영덕군 보훈회관
1929,,,,충청남도 천안시 천안 성정동 어린이공원 지하주차장 및 공중화장실
1930,대구광역시 동구 도학동 448,463907,374498,대구광역시 동구 국가정보자원관리원 대구센터
1931,,,,부산광역시 연제구 부산연제경찰서 연산파출소
1932,전라남도 함평군 함평읍 기각리 373-34,265448,275297,전라남도 함평군 전라남도 함평교육지원청
1933,,,,경기도 광명시 광명경찰서 일직파출소
1934,,,,경기도 고양시 꽃향기공원 화장실
1935,,,,경기도 고양시 숲향기공원 화장실
1936,전라남도 목포시 옥암동 1373 펠리시티몰 B1F 111호,257465,246041,전라남도 영암군 삼호 실내수영장
1937,,,,서울특별시 광진구 자양1재정비촉진구역 도시정비형 재개발사업(공공청사)
1938,,,,경상북도 경주시 황남동 포석로 공용주차장(공중화장실)
1939,전라남도 여수시 화정면 하화리 236,365348,221890,전라남도 여수시 상하화보건진료소
1940,,,,경기도 수원시 만석공원 맹꽁이화장실
1941,,,,부산광역시 해운대구 송정동경로당
1942,,,,충청남도 천안시 천안삼거리공원 화장실
1943,,,,충청남도 천안시 천안삼거리공원 체험공방
1944,,,,충청남도 천안시 천안삼거리공원 판매시설
1945,,,,충청남도 천안시 천안삼거리공원 지하주차장
1946,,,,경상남도 창원시 창원시 팔룡동 공영주차빌딩
1947,경상남도 진주시 충무공동 128,412616,285756,경상남도 진주시 대곡중학교
1948,전라남도 화순군 이양면 율계리 815-4,308341,253123,전라남도 화순군 호남119특수구조대
1949,경기도 군포시 산본동 1096-6,305734,529727,경기도 군포시 군포시 보훈회관
1950,인천광역시 남동구 남촌동  376-10,286569,537540,인천광역시 남동구 남촌 어울림 커뮤니티센터
1951,,,,경기도 성남시 복정도서관 건립공사
1952,,,,강원도 춘천시 구곡폭포 특산물 판매장
1953,,,,"대구광역시 남구 강당골 스포츠클라이밍장 조성사업 부대시설(사무소,화장실,샤워장) 및 휴게음식점"
1954,,,,"제주특별자치도 서귀포시 어촌·어항(신천항) 관광특성화사업(목욕탕, 소매점)"
1955,,,,경기도 의정부시 의정부역 동부광장 역전근린공원 화장실
1956,충청북도 진천군 덕산읍 두촌리 2749,358150,477700,충청북도 진천군 진천군 육아종합지원센터
1957,충청남도 아산시 온천동 1926,310642,466218,충청남도 아산시 방축동 제1공영주차장
1958,,,,전라남도 광양시 광양 중마수영장 건립공사
1959,,,,경상북도 영천시 부향마을 경로당
1960,전라북도 전주시 덕진구 만성동 1357-1,316637,361255,전라북도 전주시 전주양현중학교
1961,,,,경기도 파주시 가람마을공원 지하주차장
1962,경상북도 고령군 개진면 직리 804-6,428097,347019,경상북도 고령군 개진면 노인회관 경로당
1963,경상북도 구미시 신평동 188-2,433018,390919,경상북도 구미시 구미경찰서
1964,서울특별시 중랑구 상봉동 99-1,319692,555415,서울특별시 중랑구 중랑구 방정환 교육지원센터
1965,경상북도 봉화군 명호면 도천리 240-7,480284,473116,경상북도 봉화군 봉화경찰서 명호파출소
1966,경상북도 청송군 안덕면 명당리 455,486536,410370,경상북도 청송군 청송경찰서 안덕파출소
1967,,,,경상북도 영주시 장수면농촌중심지활성화사업 다목적체육관
1968,,,,제주특별자치도 제주시 제주보육원 신축공사
1969,,,,제주특별자치도 제주시 신창항 다이버 체험학습장 지원센터
1970,,,,전라남도 나주시 종자관리소청사(행정동) 건립공사
1971,,,,전라남도 보성군 겸백남성경로당 신축공사
1972,서울특별시 영등포구 여의도동 1,304098,548144,서울특별시 영등포구 국회소통관
1973,전라북도 부안군 보안면 영전리 513-20,279572,335481,전라북도 부안군 부안경찰서 보안파출소
1974,광주광역시 남구 노대동 737,300263,279156,광주광역시 남구 광주광역시 남구 치매안심센터
1975,,,,전라남도 목포시 유달산 목재문화체험장
1976,,,,경기도 평택시 오성면 행정복지센터 건립공사
1977,,,,경상북도 상주시 도림사 공중화장실
1978,경기도 고양시 덕양구 고양동 1113,303538,569135,경기도 고양시 고양2통경로당
1979,,,,경상북도 청송군 청송군 얼음골 클라이밍센터 장애인화장실 증축공사
1980,,,,경상북도 경주시 금관총 보존전시공간 신축공사
1981,,,,서울특별시 중구 동화동 공영주차장 확충 및 교육혁신센터 건립공사
1982,충청남도 서천군 비인면 성내리 313-1,274325,394361,충청남도 서천군 비인 보건지소
1983,,,,울산광역시 북구 호계커뮤니티센터
1984,,,,충청북도 충주시 동량면 동량행복센터(야외화장실 및 체육시설)
1985,,,,충청남도 금산군 금산군 진산면 체육센터
1986,,,,충청남도 아산시 커뮤니티 거점 조성 및 사회적 경제 종합지원센터
1987,,,,광주광역시 광산구 광주광역시 거점형 공공직장어린이집
1988,,,,경기도 남양주시 (가칭)남앙주 다산 지금1초등학교
1989,,,,경상남도 하동군 적량면 농촌중심지 활성화사업
1990,,,,경상북도 칠곡군 왜관시장 복합문화공간 건립공사
1991,,,,전라북도 군산시 디오션시티 철길공원 화장실
1992,,,,전라북도 고창군 고창군 어업지도선 관리사무소
1993,경상북도 청송군 현동면 개일리 265,492329,406407,경상북도 청송군 현동면 당포 경로당
1994,,,,경상북도 청송군 청송군 현동면 도평재래시장 공중화장실
1995,광주광역시 북구 문흥동 88-1,302787,288136,광주광역시 북구 광주 솔로몬 로파크
1996,,,,경기도 시흥시 (가칭) 장현2유치원 신축공사
1997,,,,경상북도 예천군 (가칭)예담유치원 신축
1998,,,,경상북도 포항시 포항시 장애인형 국민체육센터
1999,,,,경기도 시흥시 (가칭)시흥장현 공공주택지구 유치원1
2000,,,,전라남도 담양군 담양 객사리 석당간 및 남산리 오층석탑 보호구역 정비 관리사무소
2001,,,,전라남도 신안군 신안대동염전 천일염체험장조성사업
2002,,,,전라남도 고흥군 포두작은도서관 건립공사
2003,,,,전라남도 목포시 서산동 보리마당 공영주차장 내 화장실
2004,전라북도 김제시 용지면 구암리 359,305815,362064,전라북도 김제시 용지면 행정복지센터
2005,,,,제주특별자치도 제주시 한림읍 작은영화관 건립공사
2006,,,,서울특별시 동대문구 답십리동 우아세 어린이집 신축공사
2007,,,,경기도 이천시 이천시보건소 신축공사
2008,,,,충청북도 충주시 산척면 공중화장실(신축)
2009,,,,전라남도 보성군 벌교전통시장 주차환경개선사업
2010,,,,경상북도 문경시 문경 인공암장 리모델링 사업
2011,,,,경상남도 합천군 가야산국립공원 롯데공중화장실
2012,,,,충청남도 보령시 고남포 복합 문화복지 공간조성(수부2리 마을회관)
2013,,,,경기도 용인시 동천3지구 청소년시설 신축공사
2014,서울특별시 영등포구 당산동1가 186-108,302898,547304,서울특별시 영등포구 당산동1가12 도시계획시설
2015,경기도 부천시 삼정동 207,291768,547188,경기도 부천시 신흥동어울마당
2016,,,,인천광역시 옹진군 북도면 주민체육센터 건립공사
2017,,,,충청남도 보령시 관창산업단지 근로자복지센터
2018,,,,강원도 정선군 (주)강원랜드 제2직장어린이집
2019,서울특별시 마포구 염리동 148-9,307068,549866,서울특별시 마포구 염리3구역 주택재개발 정비사업
2020,,,,울산광역시 남구 울산신정 행복주택(공용주차장)
2021,,,,울산광역시 남구 울산신정 행복주택(공공도서관)
2022,,,,울산광역시 남구 울산신정 행복주택(어린이집)
2023,,,,충청남도 아산시 모산역 문화플랫폼 및 문화어울림공간 조성사업
2024,,,,전라남도 무안군 오룡지구 내 근린공원 공중화장실
2025,,,,전라남도 광양시 금속가공 열처리 지원센터
2026,,,,전라남도 신안군 신안군 예비군 부대 사무실
2027,,,,경기도 성남시 수내2동 행정복지센터 신축공사
2028,,,,세종특별자치시  행정중심복합도시 1생활권 환승주차장
2029,,,,강원도 삼척시 삼척 샛별하나어린이집
2030,경기도 수원시 장안구 영화동 422-26,311943,521109,경기도 수원시 서문경로당
2031,울산광역시 남구 두왕동 749-1,517554,324593,울산광역시 남구 울산 두왕 초등학교
2032,,,,경기도 용인시 용인산림교육센터
2033,,,,경상북도 포항시 장안경로당
2034,경기도 시흥시 정왕동 1771-12,286081,529494,경기도 시흥시 배곧초록유치원
2035,전라북도 전주시 덕진구 송천동2가 1305,322167,364521,전라북도 전주시 전주 자연초등학교
2036,경기도 수원시 권선구 세류3동 344-13,312430,518283,경기도 수원시 유천경로당
2037,경기도 이천시 마장면 오천리 412,343020,517060,경기도 이천시 이천마장초등학교
2038,,,,경기도 화성시 (가칭)능동1유치원
2039,제주특별자치도 제주시 애월읍 하귀2리 1893-1,251797,99251,제주특별자치도 제주시 하귀2리 경로당
2040,경상북도 안동시 서후면 성곡리 130-4,459549,446372,경상북도 안동시 서후면 복지회관
2041,,,,전라북도 부안군 동진면 농촌중심지활성화사업
2042,,,,경기도 시흥시 시흥시 대야3지구 어린이공원 내 공원관리사무소 및 공중화장실
2043,,,,전라남도 신안군 신안군 임자읍 공립형 지역아동센터
2044,전라북도 순창군 순창읍 순화리 479,321751,308989,전라북도 순창군 순창경찰서
2045,경상남도 양산시 원동면 용당리 산18-11,482791,308373,경상남도 양산시 당곡천 생태학습관
2046,,,,경기도 의왕시 갈미어린이공원 지하공영주차장
2047,경상북도 구미시 고아읍 원호리 78,430809,395264,경상북도 구미시 고아읍 생활체육센터
2048,,,,경상북도 칠곡군 동명지 수변생태공원 조성사업(생태학습관)
2049,,,,대전광역시 유성구 한밭대학교 지역협력 연구 및 분석지원센터
2050,,,,대전광역시 유성구 대전지방법원 광역등기소 신축 설계용역
2051,,,,전라남도 나주시 나주호 수변공원 화장실
2052,,,,인천광역시 미추홀구 (가칭)장애아 전문어린이집 및 육아종합지원센터
2053,경기도 부천시 춘의동 163-7,293038,545304,경기도 부천시 부천시 치매안심센터
2054,,,,경상남도 산청군 신촌마을 창조적마을 만들기 화장실
2055,,,,제주특별자치도 서귀포시 서귀포중앙 행복주택 신축공사 (업무시설)
2056,,,,전라남도 구례군 구례공공도서관 이설공사
2057,경기도 남양주시 수동면 입석리 338-1,340515,567768,경기도 남양주시 수동멀티스포츠센터
2058,,,,제주특별자치도 제주시 올레 13코스 공중화장실
2059,전라북도 전주시 덕진구 송천동2가 1340,321691,363866,전라북도 전주시 전주화정중학교
2060,전라북도 전주시 완산구 효자동2가 1365,319318,355901,전라북도 전주시 전주효천초등학교
2061,경기도 광주시 쌍령동 504,335677,533279,경기도 광주시 광주푸른초등학교
2062,,,,서울특별시 동대문구 답십리 제18구역 어린이집
2063,,,,울산광역시 북구 염포운동장 관리동
2064,경상남도 거제시 상동동 750-1,457865,252290,경상남도 거제시 상동1초등학교
2065,강원도 홍천군 동면 속초리 641-4,394603,563915,강원도 홍천군 속초1리 경로당
2066,,,,제주특별자치도 서귀포시 태흥3리 경로당
2067,,,,충청북도 청주시 충청북도 장애인회관 건립공사
2068,,,,제주특별자치도 제주시 선흘 동백동산 에코촌 유스호스텔 야외화장실 및 안내실
2069,전라북도 전주시 덕진구 송천동2가 1349 전주새솔유치원,322472,364213,전라북도 전주시 전주 새솔유치원
2070,,,,세종특별자치시  창의진로교육원 건립공사
2071,,,,충청남도 예산군 농촌신활력 플랫폼
2072,경기도 수원시 권선구 고색동 551,310435,515616,경기도 수원시 수원 화물자동차 공영차고지
2073,,,,강원도 춘천시 춘천 수리과학정보체험센터
2074,강원도 정선군 정선읍 봉양리 316,458798,531292,강원도 정선군 정선경찰서
2075,울산광역시 울주군 언양읍 남부리 31-4,502768,329671,울산광역시 울주군 서울주 문화센터
2076,,,,경상남도 함안군 독립유공 이태준 기념관 건립사업
2077,울산광역시 북구 염포동 193,526322,327084,울산광역시 북구 소금포역사관
2078,,,,강원도 원주시 태장1동 행정문화복합센터 신축공사
2079,,,,충청남도 청양군 장곡지구 공중화장실
2080,충청남도 서천군 마서면 계동리 22,283692,385409,충청남도 서천군 마서면 주민자치센터
2081,경상남도 창원시 마산회원구 봉암동 666-53,455042,290456,경상남도 창원시 창원해양경찰서
2082,,,,경상북도 성주군 법산마을회관
2083,울산광역시 중구 우정동 277-18,519192,329216,울산광역시 중구 우정동 행정복지센터
2084,경상북도 경주시 성건동 620-83,509533,362393,경상북도 경주시 경주시 치매안심센터
2085,,,,서울특별시 서대문구 서대문구의회 청사(복합청사)
2086,,,,대전광역시 대덕구 송촌동 상점가 공영주차 전용빌딩
2087,,,,충청북도 충주시 옹달샘 시장 화장실
2088,,,,대전광역시 대덕구 신탄진 도시재생 뉴딜사업 공영주차장 건립공사
2089,,,,충청남도 서산시 비점오염저감시설 공중화장실(용암리)
2090,,,,충청남도 서산시 비점오염저감시설 공중화장실(부장리)
2091,전라북도 고창군 해리면 동호리 627,262616,325151,전라북도 고창군 동호해수욕장 공중화장실
2092,,,,전라북도 부안군 변산반도국립공원 내변산분소 신축공사
2093,,,,인천광역시 서구 인천도시철도 1호선 검단연장선 103정거장
2094,,,,인천광역시 서구 인천도시철도 1호선 검단연장선 102정거장
2095,,,,인천광역시 서구 인천도시철도 1호선 검단연장선 101정거장
2096,서울특별시 강동구 천호동 308-10,323209,549592,서울특별시 강동구 강동구 청소년 문화의집
2097,,,,경상남도 양산시 양산 석계2일반산업단지 공중화장실
2098,경상남도 김해시 장유동 871,475710,285424,경상남도 김해시 김해율산초등학교(율하2택지 2초등학교)
2099,충청북도 청주시 흥덕구 강서동 9-2,348860,447448,충청북도 청주시 강서2동 주민센터
2100,경상남도 김해시 장유동 872,475785,285520,경상남도 김해시 김해모산중학교(율하2택지 중학교)
2101,경상남도 창원시 의창구 중동 789,457485,295147,경상남도 창원시 의창초등학교(중동2초등학교)
2102,경상북도 경산시 상방동 242-3,467000,356866,경상북도 경산시 경상북도 재활병원
2103,경상북도 영천시 화룡동 989,483390,375127,경상북도 영천시 한국폴리텍대학 로봇캠퍼스
2104,,,,경상남도 진주시 신진주초등학교 교사 신축공사
2105,충청북도 옥천군 옥천읍 하계리 1-1,362958,412939,충청북도 옥천군 옥천전통문화체험관
2106,,,,경상남도 하동군 하동서 금성파출소
