,address,mapx,mapy,name
2681,제주특별자치도 서귀포시 표선면 성읍리 1382,288032,88154,제주특별자치도 서귀포시 성읍 119 지역센터
2682,,,,부산광역시 강서구 부전-마산 복선전철 민간투자시설사업 BM02 정거장
2683,,,,경상남도 김해시 부전 - 마산 복선전철 민간투자시설사업 장유역
2684,전라북도 전주시 완산구 중화산동2가 산66,321023,358188,전라북도 전주시 전주시립도서관
2685,세종특별자치시  조치원읍 봉산리 59,336055,444877,세종특별자치시  세종시보건환경연구원
2686,,,,인천광역시 강화군 월곳리 대묘동 경로당 신축공사
2687,인천광역시 남동구 구월동 1236-7,286761,539415,인천광역시 남동구 대구월 경로당
2688,경기도 연천군 백학면 두일리 477-3,304524,603429,경기도 연천군 연천군 국공립어린이집
2689,,,,전라남도 구례군 봉동리 4구 경로당
2690,,,,전라북도 완주군 지역재생형 운주농촌유학센터
2691,,,,전라남도 영광군 스포티움 축구장 공중화장실
2692,전라남도 영광군 군남면 백양리 549-20,259043,294586,전라남도 영광군 군남면 보건지소
2693,,,,경기도 고양시 (가칭)향동고등학교
2694,,,,강원도 횡성군 횡성읍사무소(본관동)
2695,,,,경기도 가평군 가평 청사복합 따복하우스
2696,,,,인천광역시 서구 서구 경서3구역 도시개발사업 공영주차장(주차장9)
2697,,,,인천광역시 서구 서구 경서3구역 도시개발사업 공영주차장(주차장6)
2698,,,,인천광역시 서구 서구 경서3구역 도시개발사업 공영주차장(주차장5)
2699,,,,경기도 용인시 용인자연휴양림 나눔숲복지센터
2700,경상남도 창원시 마산합포구 월영동 720-1,452053,286508,경상남도 창원시 마산소방서 소방정대
2701,,,,서울특별시 성동구 옥수 푸른숲 어린이집
2702,충청북도 청주시 상당구 영운동 179-1,355000,446511,충청북도 청주시 영운국민체육센터
2703,세종특별자치시  한솔동 961,333513,430977,세종특별자치시  한솔동 복합커뮤니티센터(정음관)
2704,울산광역시 울주군 온양읍 대안리 245-3,517341,312724,울산광역시 울주군 온양 솔밭경로당
2705,,,,전라남도 해남군 해남군 보훈회관 신축공사
2706,,,,충청남도 공주시 공주우금치전적 방문자센터 건립공사
2707,경기도 구리시 갈매동 654,322560,558963,경기도 구리시 구리경찰서 갈매파출소
2708,,,,대전광역시 중구 대전중부경찰서 유등지구대 청사 신축공사
2709,,,,울산광역시 울주군 남부 청소년수련관 건립공사
2710,,,,충청남도 천안시 오룡 주차빌딩 및 공원조성 공사
2711,강원도 고성군 죽왕면 오호리 64-2,446176,635956,강원도 고성군 죽왕보건지소
2712,,,,강원도 인제군 북면 복합커뮤니티센터 건립공사
2713,,,,경기도 포천시 포천청년여행창고
2714,서울특별시 구로구 개봉동 403-29,298988,544033,서울특별시 구로구 개봉2동 주민센터
2715,강원도 원주시 무실동 1733-9,393899,526226,강원도 원주시 국민건강보험공단 원주횡성지사
2716,,,,경상남도 하동군 하동군 노인·장애인 종합복지관
2717,제주특별자치도 제주시 영평동 2072,266880,97823,제주특별자치도 제주시 제주소방서 아라119센터
2718,부산광역시 기장군 정관읍 용수리 1314-2,507378,303495,부산광역시 기장군 정관노인복지관
2719,,,,제주특별자치도 제주시 한림2리 새마을회 경로당
2720,경상북도 안동시 용상동 1517-263,468127,439066,경상북도 안동시 안동시 치매안심센터
2721,인천광역시 계양구 계산동  911-34,288116,549964,인천광역시 계양구 안산 경로당
2722,,,,경기도 남양주시 (가칭)진건2초등학교
2723,,,,서울특별시 송파구 역도경기장
2724,경기도 수원시 장안구 조원동 9-2,313461,523267,경기도 수원시 수원시 환경성질환 아토피센터
2725,충청남도 청양군 청양읍 송방리 364-4,291969,428712,충청남도 청양군 청양 다목적실내체육관
2726,충청북도 제천시 화산동 638,419302,502857,충청북도 제천시 화산동 행정복지센터
2727,,,,경기도 이천시 이천보건소 남부치매안심센터
2728,서울특별시 도봉구 도봉동 652,316436,564767,서울특별시 도봉구 도봉동 다목적체육센터
2729,,,,경기도 포천시 포천 신북파출소
2730,강원도 철원군 동송읍 이평리 662-1,332082,623471,강원도 철원군 철원 어린이 실내 상상놀이터
2731,,,,경기도 양평군 (가칭)양근 교직원 공동사택
2732,,,,인천광역시 미추홀구 수산기술지원센터 청사
2733,울산광역시 울주군 상북면 양등리 310,497377,334130,울산광역시 울주군 상북 양등경로당
2734,,,,울산광역시 울주군 두동 곽성경로당
2735,전라남도 나주시 이창동 506-13,282440,267198,전라남도 나주시 나주시 일자리종합지원센터
2736,전라북도 임실군 오수면 금암리 463-10,340107,326755,전라북도 임실군 전라북도 국제양궁장
2737,전라남도 장성군 장성읍 영천리 1475-5,289468,301250,전라남도 장성군 장성군 공공실버주택
2738,,,,전라북도 남원시 김주열열사 생가 주차장 화장실 신축
2739,전라남도 해남군 해남읍 해리 186,272839,220056,전라남도 해남군 해남군 치매안심센터
2740,경상남도 창원시 의창구 동읍 본포리 456,458758,306841,경상남도 창원시 가곡경로당
2741,,,,경상북도 상주시 은척면 봉중리 체육공원 공중화장실
2742,경상남도 양산시 신기동 652-15,494190,306144,경상남도 양산시 쌍벽루아트홀
2743,,,,전라북도 김제시 지평선산업단지 비즈니스센터
2744,,,,경기도 안양시 해누리 어린이집 신축공사
2745,,,,경상남도 산청군 산청 남부 도서관
2746,,,,서울특별시 영등포구 신길4동 공공복합청사
2747,경기도 가평군 가평읍 대곡리 174-3,357350,580285,경기도 가평군 음악역 1939
2748,제주특별자치도 제주시 도남동 1218-3,262464,99369,제주특별자치도 제주시 제주문학관
2749,경상남도 창원시 마산합포구 해운동  61-1,451504,287221,경상남도 창원시 창원보건소 치매안심센터
2750,,,,"서울특별시 강남구 삼성2파출소, 기동순찰대 통합청사"
2751,강원도 원주시 무실동 694-14,393433,524722,강원도 원주시 무실빛 유치원
2752,,,,경기도 수원시 법무부기록관 신축설계 용역
2753,,,,서울특별시 도봉구 동부간선도로 지하차도 관리사무소 및 도봉문화센터
2754,,,,경상북도 김천시 김천평화 행복주택(복합문화센터) 건설공사
2755,제주특별자치도 제주시 노형동 938-11,259369,99739,제주특별자치도 서귀포시 제주 음악창작소
2756,전라남도 강진군 강진읍 동성리 66-3,287920,227352,전라남도 강진군 강진군 치매안심센터
2757,,,,충청남도 당진시 고대농업인상담소
2758,,,,충청남도 홍성군 국립서해안기후대기센터
2759,충청남도 공주시 주미동 94-5,319695,425053,충청남도 공주시 공주시 노인회관
2760,,,,경상남도 양산시 주민치유마당 화장실
2761,,,,경상남도 양산시 도요문화센터
2762,강원도 정선군 정선읍 북실리 764-14,457658,531035,강원도 정선군 정선군 청소년수련관
2763,,,,경기도 하남시 (가칭)감일고등학교
2764,대전광역시 서구 관저동  1583,340625,410486,대전광역시 서구 관저다목적체육관
2765,,,,경상북도 영천시 동부동4통 경로당
2766,,,,경상북도 상주시 속리산 시어동 휴양체험단지 관리사무소
2767,강원도 삼척시 남양동  113,503403,538100,강원도 삼척시 삼척 기적의 도서관
2768,경상북도 울진군 울진읍 읍내리 49-1,525158,488810,경상북도 울진군 울진군 보훈회관
2769,세종특별자치시 다정동 22-2,332291,432791,세종특별자치시  다정고등학교
2770,경상북도 예천군 호명면 오천리 210-1,442317,443630,경상북도 예천군 호명라온유치원
2771,경상북도 군위군 산성면 삼산리 1000,463721,388400,경상북도 군위군 삼산보건진료소
2772,,,,강원도 홍천군 서석면 체육공원 공중화장실
2773,경기도 안산시 상록구 사동 1273,297449,520758,경기도 안산시 명휘체육센터
2774,경기도 안산시 상록구 사동 1586,297901,522603,경기도 안산시 안산시 장애인지원센터
2775,,,,경상북도 안동시 예안향교 주차장 공중화장실
2776,대구광역시 중구 봉산동 2-2,453999,363133,대구광역시 중구 성내1동 주민센터
2777,서울특별시 성북구 석관동 63-3,317544,556619,서울특별시 중랑구 중화2동 주민공동이용시설
2778,,,,경상남도 거제시 복항마을(매미성) 공중화장실
2779,경기도 오산시 원동 481-17,318003,503837,경기도 오산시 오산시 소리울도서관
2780,전라북도 익산시 웅포면 웅포리 898-1,299155,385638,전라북도 익산시 웅포보건지소
2781,,,,경기도 양주시 남면 신산시장 복합센터 건립공사
2782,,,,강원도 홍천군 두촌면 농촌중심지활성화사업 복지회관
2783,,,,전라남도 나주시 빛고을 정신요양원 남자생활관
2784,,,,전라북도 고창군 세이브더칠드런 고창 농어촌 놀이터
2785,전라남도 순천시 낙안면 동내리 202,340489,256836,전라남도 순천시 낙안보건지소
2786,,,,전라북도 완주군 혁신도시 소리공원내 여성전용 공중화장실
2787,전라북도 전주시 완산구 효자동1가 545-3 좋은빌딩3층,320691,356604,전라북도 전주시 전주시 아동청소년센터
2788,,,,전라남도 여수시 남면 역포대합실 신축공사
2789,,,,강원도 홍천군 홍천 무궁화수목원 방문자센터
2790,,,,전라남도 여수시 여자중계민원처리소
2791,,,,경기도 남양주시 (가칭)녹촌유치원
2792,,,,경상북도 영양군 일월면분회 경로당
2793,경기도 수원시 팔달구 고등동 153-1,311611,519537,경기도 수원시 고등동 행정복지센터
2794,경기도 여주시 북내면 당우리 40-2,371564,525830,경기도 여주시 북내 실내체육관
2795,,,,경상남도 고성군 고성향토역사관
2796,충청북도 증평군 증평읍 증평리 482,363240,464569,충청북도 증평군 증평군 보훈회관
2797,전라남도 담양군 금성면 외추리 98,312176,302818,전라남도 담양군 외추보건진료소
2798,인천광역시 미추홀구 숭의동 161-26,280330,541144,인천광역시 미추홀구 모퉁이보호작업장
2799,,,,부산광역시 사상구 부산사상경찰서 학장파출소
2800,,,,경상북도 상주시 화북면 중벌리 체육공원 공중화장실
2801,대구광역시 동구 내동 212-3,459744,374639,대구광역시 동구 내동경로당
2802,,,,경기도 평택시 신촌지구 근린공원 공중화장실
2803,,,,경기도 평택시 신촌지구 체육공원 공중화장실
2804,,,,충청북도 영동군 영산동 공영주차장 복층화사업
2805,인천광역시 강화군 강화읍 국화리 46-2,265208,573575,인천광역시 강화군 강화고인돌체육관
2806,울산광역시 북구 화봉동 450-1,524156,332978,울산광역시 북구 북구 노인회관
2807,경기도 오산시 외삼미동 290-3,316771,510355,경기도 오산시 삼미초등학교
2808,,,,경기도 오산시 화양면사무소
2809,,,,경기도 양주시 (가칭)옥정1고등학교
2810,,,,경기도 시흥시 (가칭)목감1유치원
2811,,,,세종특별자치시  (가칭) 해밀중고등학교
2812,,,,세종특별자치시  (가칭) 해밀초등학교
2813,경기도 의왕시 삼동 628,307779,524489,경기도 의왕시 부곡동 청소년 문화의 집
2814,,,,"경상북도 청도군 청도군 각북면 농촌중심지 활성화사업(행복주민센터, 주민행복마당)"
2815,,,,광주광역시 북구 무돌길(금곡마을) 공중화장실
2816,경기도 화성시 장지동 972,321165,506950,경기도 화성시 서연중학교
2817,대구광역시 달서구 월성동  273,448158,359305,대구광역시 달서구 월성수복정경로당
2818,경상북도 영양군 입암면 신구리 534-2,497658,444102,경상북도 영양군 입암면분회(신구리) 경로당
2819,,,,서울특별시 강남구 개포초등학교 및 유치원
2820,서울특별시 은평구 녹번동 11-3,306040,556627,서울특별시 은평구 은평구 어르신일자리 지원센터
2821,제주특별자치도 제주시 이도일동 1775-12,263398,101490,제주특별자치도 제주시 제주 삼성혈 전시관
2822,,,,경상남도 양산시 양산 비즈니스센터 및 첨단하이브리드 생산기술 센터
2823,,,,경상남도 양산시 상북면 어울림마당 공중화장실
2824,,,,충청북도 제천시 제천시 치매가족쉼터
2825,,,,충청북도 괴산군 사리면 예비군중대본부
2826,경상남도 통영시 정량동 52-3,440381,250507,경상남도 통영시 통영시 화장시설
2827,경상남도 의령군 의령읍 서동리 560,423169,301948,경상남도 의령군 의령군 청소년문화의 집
2828,대구광역시 수성구 삼덕동 552-1,460613,358878,대구광역시 수성구 삼덕동 경로당
2829,,,,제주특별자치도 제주시 조천 주민교류센터
2830,강원도 홍천군 동면 노천리 1441,401422,562893,강원도 홍천군 노천 초등학교
2831,,,,경기도 남양주시 다산진건지구 공영주차장(타워식)
2832,전라남도 곡성군 오곡면 오지리 909-1,337740,297315,전라남도 곡성군 곡성경찰서 오곡파출소
2833,인천광역시 연수구 송도동 6-1,280307,532565,인천광역시 연수구 송도컨벤시아 1단계
2834,,,,경기도 광명시 광명7동 주민센터 신축공사
2835,,,,세종특별자치시  행정중심복합도시 3-11호 어린이공원
2836,,,,부산광역시 동구 부산희망드림 종합센터
2837,,,,부산광역시 강서구 부산지방기상청 청사
2838,전라남도 화순군 화순읍 유천리 258-4,308787,274671,전라남도 화순군 무등산국립공원동부사무소
2839,대구광역시 서구 비산동 223-4,451997,363503,대구광역시 서구 비산4동 어린이집
2840,,,,세종특별자치시  (가칭) 해밀유치원
2841,부산광역시 기장군 정관읍 모전리 676,506047,305317,부산광역시 기장군 정관 아쿠아 드림파크
2842,강원도 강릉시 포남동 1295-2,480663,574875,강원도 강릉시 포남1동 주민센터
2843,,,,경기도 김포시 김포향산 근린공원 관리사무소
2844,,,,충청남도 천안시 직산 삼은저수지 생활체육공원 내 화장실 및 게이트볼장
2845,,,,충청남도 태안군 소원면 공립형 지역아동센터
2846,충청남도 논산시 성동면 병촌리 351,311392,399608,충청남도 논산시 성광온누리학교
2847,,,,경기도 화성시 통탄 아름드림센터
2848,경기도 시흥시 정왕동 1800-6,288652,528148,경기도 시흥시 시흥어울림국민체육센터
2849,,,,강원도 삼척시 도계 평생학습관
2850,경상남도 창원시 진해구 석동 140,464448,283994,경상남도 창원시 석동 공영주차빌딩
2851,,,,제주특별자치도 제주시 판포리 게이트볼장
2852,,,,전라남도 영광군 미래 이동수단 사용자 경헙랩
2853,,,,제주특별자치도 서귀포시 신례1리 마을 복지회관
2854,서울특별시 양천구 목동 771-5,300110,548669,서울특별시 양천구 구립 목4동 어린이집
2855,,,,충청남도 천안시 천안북부스포츠센터(운동장)
2856,충청남도 천안시 서북구 성환읍 매주리 393-10,322839,477951,충청남도 천안시 천안북부스포츠센터
2857,,,,경기도 수원시 서호꽃뫼공원-The 큰 통합놀이터
2858,경기도 평택시 현덕면 덕목리 521-3,307350,484072,경기도 평택시 현덕축구장
2859,,,,충청북도 음성군 음성군 평생학습관
2860,,,,강원도 양양군 송이연어푸드 디자인센터
2861,,,,경기도 안산시 아이러브맘카페 2호점 건립공사
2862,,,,전라북도 김제시 청년창업공간『아토(芽土)』
2863,,,,경상북도 울진군 흥부 하나어린이집
2864,경기도 안양시 만안구 안양동 707-139,304700,532958,경기도 안양시 석수1동 경로당
2865,,,,서울특별시 양천구 목동 센트럴 아이파크위브(4단지)
2866,,,,서울특별시 양천구 목동 센트럴 아이파크위브(3단지)
2867,,,,서울특별시 양천구 목동 센트럴 아이파크위브(2단지)
2868,,,,서울특별시 양천구 목동 센트럴 아이파크위브(1단지)
2869,,,,전라남도 진도군 국민해양안전관 건립사업(유스호스텔)
2870,,,,전라남도 진도군 국민해양안전관 건립사업(국민해양안전관)
2871,,,,충청북도 충주시 충주시 유소년 축구장
2872,,,,제주특별자치도 서귀포시 발자국 화석산지 수장고
2873,경기도 시흥시 정왕동 2572,286182,529468,경기도 시흥시 배곧 한울초등학교
2874,인천광역시 서구 오류동 1735-3 1층,279437,555577,인천광역시 서구 인천 서부소방서 오류119안전센터
2875,,,,전라남도 화순군 화순군 치매안심센터 및 기초정신건강복지센터
2876,,,,강원도 동해시 청운경로당
2877,강원도 동해시 구미동  589-6,499978,542424,강원도 동해시 해오름 경로당
2878,,,,제주특별자치도 제주시 제주시 한림읍 청사 신축공사
2879,,,,경기도 김포시 운양환승센터 조성사업(B동)
2880,,,,경기도 김포시 운양환승센터 조성사업(A동)
2881,,,,서울특별시 양천구 용왕산 화장실 및 관리실
2882,,,,충청북도 단양군 단성면 상방리 다목적회관
2883,,,,"경상남도 김해시 부원 2,3,4통 경로당"
2884,,,,경상북도 구미시 구미시 공설 숭조당 2관
2885,,,,경상북도 성주군 성주군 어린이놀이터(공중화장실)
2886,경기도 포천시 일동면 기산리 88-31,340038,595014,경기도 포천시 포천시 치매안심센터 일동쉼터
2887,충청북도 청주시 청원구 주성동 297-19,355433,453609,충청북도 청주시 청주시 새활용시민센터
2888,인천광역시 서구 청라동 155-14,280365,548698,인천광역시 서구 청라3동 행정복지센터
2889,경기도 구리시 인창동 626,323290,556406,경기도 구리시 시립인창어린이집
2890,,,,경기도 연천군 동두천~연천 복선전철 연천역사
2891,,,,경기도 연천군 동두천~연천 복선전철 초성리역사
2892,,,,경기도 연천군 동두천~연천 복선전철 전곡역사
2893,,,,경상북도 경주시 영천-신경주 복선전철 아화역사
2894,울산광역시 울주군 삼남읍 가천리 385-2,499079,326351,울산광역시 울주군 삼남면가천경로당
2895,,,,경기도 평택시 새한어린이공원 공중화장실
2896,강원도 인제군 기린면 방동리,433894,594093,강원도 인제군 인제군 방동리 경로당
2897,,,,전라북도 부안군 새만금 환경생태용지 방문자센터
2898,,,,경상남도 진주시 경남진주혁신도시 복합혁신센터
2899,,,,전라남도 고흥군 남양면 다목적 복지회관
2900,,,,전라북도 고창군 고창군 장애인주간보호 직업재활시설
2901,,,,서울특별시 강남구 개원 지구대
2902,서울특별시 강남구 개포동 14-4,318693,543898,서울특별시 강남구 개포동 우체국
2903,서울특별시 강남구 개포동 1164-16,316484,541697,서울특별시 강남구 개포 어린이집
2904,,,,경기도 안양시 호원지구 소공원 지하 공영주차장 조성사업
2905,,,,전라남도 광양시 광양시 기능훈련센터 신축공사
2906,,,,전라북도 고창군 국민건강보험공단 고창출장소 사옥신축공사
2907,대구광역시 달서구 송현동 2003-32,450357,359183,대구광역시 달서구 달서영어도서관
2908,,,,경기도 양주시 (가칭)옥정10초등학교
2909,경기도 안양시 동안구 비산동 488-15,305783,533630,경기도 안양시 비산1동 행정복지센터
2910,제주특별자치도 서귀포시 신효동 700-2,271095,75200,제주특별자치도 서귀포시 서귀포시 신효경로당
2911,,,,경상남도 양산시 이팝문화센터
2912,강원도 강릉시 강동면 상시동리 150-1,484344,569791,강원도 강릉시 강동파출소
2913,,,,경상남도 남해군 남해군 가인포보건진료소
2914,,,,경상남도 창원시 월영 주거환경개선사업 경로당
2915,경기도 성남시 수정구 수진동 4417,323521,537525,경기도 성남시 성남소방서
2916,,,,강원도 홍천군 남면 신대1리 마을회관 및 경로당
2917,,,,강원도 홍천군 자은리 친환경 공중화장실
2918,,,,경기도 화성시 (가칭)동탄10초등학교
2919,경상북도 성주군 초전면 대장리 592,423930,375163,경상북도 성주군 초전어린이집
2920,대구광역시 달성군 다사읍 죽곡리 816,442220,361568,대구광역시 달성군 심인고등학교
2921,대구광역시 달성군 다사읍 죽곡리 819,442340,361590,대구광역시 달성군 심인중학교
2922,,,,전라북도 고창군 바람숲 화장실
2923,충청남도 아산시 장존동 185-9,310135,461314,충청남도 아산시 충청남도교육청 과학교육원
2924,충청북도 옥천군 군서면 은행리 143-2,356789,407854,충청북도 옥천군 옥천군 군서면 은행보건진료소
2925,경상남도 진주시 문산읍 삼곡리 640-1,415408,285341,경상남도 진주시 경상남도교육청 학생안전체험교육원
2926,,,,경기도 김포시 걸포3지구 중앙공원 관리사무소
2927,,,,제주특별자치도 제주시 신양1리 마을회관
2928,,,,경상남도 창원시 병암동 다목적주민자치사랑방
2929,강원도 양양군 양양읍 남문리,454883,608288,강원도 양양군 양양전통시장 주차장
2930,경기도 남양주시 다산동 3209-2,326753,557015,경기도 남양주시 경기시청자미디어센터
2931,,,,서울특별시 성북구 장위5구역 내 노유자시설
2932,경상북도 청송군 청송읍 월막리 198-2,495036,426394,경상북도  청송읍 분회경로당
2933,경상남도 김해시 전하동  17-1,479698,292096,경상남도 김해시 전하3통 경로당
2934,,,,전라남도 무안군 무안 각설이 품바 전승관
2935,,,,충청북도 충주시 칠금동 주차전용건축물
2936,,,,전라북도 순창군 복흥면 청소년문화의 집 및 노인교실
2937,강원도 화천군 사내면 사창리 459-8,358050,607703,강원도 화천군 토마토수영장
2938,,,,서울특별시 송파구 가락1동 주민센터 및 가락1동 어린이집
2939,,,,대전광역시 서구 노루벌 구절초와 반디의 숲 체험원
2940,,,,부산광역시 사상구 부산도시철도 사상~하단선 503 정거장
2941,,,,부산광역시 사상구 부산도시철도 사상~하단선 스마트시티 정거장
2942,제주특별자치도 서귀포시 월평동 476-1,256625,73131,제주특별자치도 서귀포시 서귀포 시각장애인 주간보호시설
2943,인천광역시 미추홀구 도화동 95-30,281878,541500,인천광역시 미추홀구 주안동 장애인거주시설
2944,,,,충청남도 예산군 신례원 버스승강장 공중화장실
2945,경기도 동두천시 상봉암동 15,318113,594518,경기도 동두천시 소요 별&숲 테마파크
2946,,,,경상북도 성주군 성밖숲정보센터
2947,,,,충청남도 논산시 논산시사람꽃복지관(구 논산시장애인종합복지관)
2948,,,,전라북도 군산시 국립신시도자연휴양림 조성사업
2949,,,,경상북도 칠곡군 (가칭)남율중학교 신축공사
2950,,,,울산광역시 동구 동울산종합시장 공영주차장 및 고객지원센터
2951,,,,서울특별시 중구 서울시 시네마테크 건립
2952,,,,서울특별시 도봉구 창동 창업 및 문화 산업단지 조성사업
2953,경기도 김포시 풍무동 156-5,287827,556846,경기도 김포시 김포시 풍무도서관
2954,전라남도 보성군 노동면 광곡리 254,314927,244949,전라남도 보성군 보성군 노동면사무소
2955,,,,경상남도 의령군 의령 농가형 전통장류 활성화센터
2956,,,,경상북도 안동시 안동시 북후면 농촌중심지활성화 공중화장실
2957,대전광역시 유성구 봉산동  216,345326,426296,대전광역시 유성구 봉산어린이공원 공중화장실
2958,,,,전라남도 순천시 환선정 창작공원 관광명소화사업
2959,경기도 화성시 향남읍 상신리 1308,302145,500413,경기도 화성시 시립향남공원 어린이집
2960,,,,전라남도 진도군 진도읍 환경미화원 복지센터
2961,,,,경기도 광명시 하안1동 밤일마을 경로당 건립공사
2962,,,,강원도 홍천군 서면 생활체육공원 다목적 체육시설
2963,경상남도 창원시 진해구 자은동 146,465170,284142,경상남도 창원시 진해경찰서 자은파출소
2964,,,,경상남도 김해시 선지공원 공중화장실
2965,,,,경상남도 김해시 선천들공원 공중화장실
2966,,,,경상남도 김해시 무지개공원 공중화장실 2
2967,,,,경상남도 김해시 무지개공원 공중화장실 1
2968,전라남도 여수시 학동 201,368821,239800,전라남도 여수시 학동 공중화장실
2969,,,,전라남도 여수시 꽃가람공원 편익시설(공중화장실)
2970,,,,전라남도 여수시 백야항 화장실
2971,,,,전라북도 군산시 익산~대야 복선전철 대야역사
2972,대전광역시 서구 갈마동 820,343863,417567,대전광역시 서구 월평도서관
