index,title,address,lat,lon
0,경상남도 창원시 창원서부경찰서 동읍파출소,경남 창원시 의창구 동읍 용잠리 222-5,35.2787182404502,128.689282964033
1,서울특별시 영등포구 영등포동 공공복합시설 건립공사,,,
2,충청북도 진천군 광혜원 문화복지회관,,,
3,서울특별시 노원구 서울과학기술대학교 창조융합연구동,서울 노원구 공릉동 189,37.6298580333571,127.079322579266
4,경기도 양평군 양동면 삼산보건진료소,,,
5,경기도 파주시 법원읍 행정복지센터,경기 파주시 법원읍 법원리 376-1,37.8490489585185,126.882392907004
6,경기도 화성시 서경초등학교,경기 화성시 기산동 477,37.217019843865,127.050864337613
7,경상북도 칠곡군 석적유치원,경북 칠곡군 석적읍 중리 208-3,36.0758168568304,128.413952490863
8,충청남도 태안군 사법역사문화교육관,충남 태안군 안면읍 중장리 765-44,36.4822639577051,126.336654802057
9,인천광역시 계양구 인천광역시 농업기술지원센터,,,
10,충청남도 서산시 (가칭)서산예천유치원,,,
11,강원도 화천군 화천신읍 공공실버주택,강원 화천군 화천읍 신읍리 658-4,38.1147448299119,127.702546292365
12,경상남도 창녕군 남지국민체육센터(작은영화관),,,
13,충청북도 청주시 (가칭) 서현2초등학교 신축공사,,,
14,경상북도 봉화군 국립공원공단 태백산국립공원 백천분소,,,
15,경상남도 진주시 진주 충효교육원 별관,,,
16,경기도 의정부시 고산지구 주6 주차타워,,,
17,부산광역시 연제구 한빛공원 공영주차장 건립,,,
18,경상남도 밀양시 의열체험관,,,
19,부산광역시 영도구 대통전수방 창의산업공간,,,
20,경기도 수원시 수원시 매산동 행복주택 및 행정복지센터 복합개발 사업,,,
21,충청남도 금산군 자연치유교육및문화체험권역개발사업 B동,,,
22,충청남도 금산군 자연치유교육및문화체험권역개발사업 A동,,,
23,대구광역시 중구 동인커뮤니티센터,대구 중구 동인동3가 328-2,35.8730687278374,128.610908213387
24,강원도 원주시 기업유치원 신축공사,,,
25,경상북도 고령군 우곡면(객기) 기초생활 거점조성사업,,,
26,경기도 화성시 삼괴청소년 문화의집,,,
27,경상남도 통영시 정량천 생태하천 공중화장실,,,
28,경상남도 거제시 아주 청소년 문화의집,,,
29,전라남도 무안군 남악신도시 파크골프장,,,
30,전라남도 무안군 남악신도시 자전거공원 공중화장실,,,
31,전라남도 순천시 순천 트레이닝센터 건립공사,,,
32,광주광역시 남구 월산2 어린이공원 화장실,광주 서구 화정동 892,35.1409848940965,126.876867714261
33,전라남도 나주시 종자관리소청사(행정동) 건립공사,,,
34,경기도 고양시 고양 내일꿈제작소,,,
35,경상남도 진주시 진주시 장애인 문화체육센터,,,
36,경기도 수원시 호매실 2유치원,경기 수원시 권선구 호매실동 411-1,37.2668776274001,126.955541746305
37,경기도 연천군 연천군 다목적복지센터,,,
38,경기도 가평군 가평 북면파출소,경기 가평군 북면 목동리 848,37.8856826764873,127.550076485529
39,제주특별자치도 서귀포시 상예1 다목적회관,,,
40,충청남도 당진시 대덕초등학교,충남 당진시 대덕동 1882,36.8830691903604,126.63967765492
41,강원도 고성군 토성청소년문화의집,,,
42,울산광역시 북구 북구 평생학습관,울산 북구 연암동 1118-2,35.5844888316188,129.361724753547
43,대전광역시 유성구 대전유성경찰서 신성지구대,,,
44,제주특별자치도 제주시 사회복지법인 유진 단기거주시설(해안빌리지),,,
45,인천광역시 강화군 신문4리 경로당,,,
46,전라남도 강진군 칠량면 기초생활거점사업,,,
47,인천광역시 강화군 인산1리(호곡) 경로당,인천 강화군 양도면 인산리 365-1,37.6960551592454,126.422007681461
48,충청남도 아산시 아산경찰서 탕정파출소,충남 아산시 탕정면 용두리 487,36.799193212472,127.04722730163
49,광주광역시 광산구 하남3지구 주민복합시설 건립공사,,,
50,경상북도 경주시 (가칭) 제2종합안전체험관,,,
51,경상북도 영주시 영주시 신영주 번개시장 주차장,,,
52,경상남도 합천군 합천군 평생학습관,경남 합천군 합천읍 합천리 387-4,35.5672304737305,128.165891707448
53,대구광역시 동구 도동문화마을 커뮤니티센터,대구 동구 도동 470-1,35.9191676910053,128.66239095309
54,경상남도 양산시 물금2고등학교 교사 신축공사,,,
55,부산광역시 강서구 신호민원센터,,,
56,충청남도 당진시 당진꿈나래학교,충남 당진시 합덕읍 운산리 678-42,36.8122015027559,126.762137866805
57,경기도 시흥시 벅스빌리지 건립공사,,,
58,경상남도 창원시 북면1고등학교,경남 창원시 의창구 소답동 159-19,35.2619673877991,128.630904490969
59,충청남도 천안시 (가칭)천안성성2유치원,,,
60,충청남도 공주시 공주세무서,충남 공주시 반죽동 332,36.454142416806,127.120461821833
61,강원도 인제군 인제군 장애인보호 작업장 신축공사,,,
62,전라북도 군산시 군산 회현면 면청사 건립사업,,,
63,전라북도 군산시 너나들이 쉼터 신축공사,,,
64,전라북도 부안군 부안해양경찰서 구조대 청사 신축공사,,,
65,전라남도 화순군 화순내수면 양식단지,,,
66,충청남도 아산시 아산시 여성커뮤니티 센터,,,
67,강원도 홍천군 홍천남산유치원,강원 홍천군 홍천읍 연봉리 158-1,37.6827267472736,127.877963383452
68,울산광역시 북구 울산교육연수원,울산 북구 정자동,35.6166927379079,129.443094530052
69,서울특별시 양천구 신정종합사회복지관,서울 양천구 신정동 919-6,37.5272623219076,126.855617467081
70,경상북도 포항시 죽도시장 공영주차장,경북 포항시 북구 죽도동 2-69,36.0363458258605,129.367269566945
71,서울특별시 영등포구 당산근린공원,서울 영등포구 당산동3가 385,37.5255122202678,126.895769419966
72,충청북도 보은군 내북면 농촌중심지 활성화사업 생태 공중화장실,,,
73,충청북도 보은군 내북면 농촌중심지 활성화사업 쉼터 공중화장실,,,
74,경기도 파주시 파주 운정 다누림 복지관,,,
75,전라남도 완도군 완도군 고금면 면사무소,전남 완도군 고금면 농상리 409,34.3949511549156,126.80429881936
76,경기도 시흥시 시흥배곧우체국 건립공사,,,
77,경기도 동두천시 동두천 자연휴양림,,,
78,경기도 고양시 고양 드론센터,경기 고양시 덕양구 대자동 645-6,37.7137136478885,126.886424418041
79,전라남도 순천시 순천시 신대도서관,전남 순천시 해룡면 신대리,34.9339333826056,127.561892307361
80,경기도 화성시 (가칭)동탄7고등학교,,,
81,충청북도 청주시 가로수도서관,충북 청주시 흥덕구 가경동 1804,36.6184264209812,127.427948463228
82,전라북도 군산시 대야면 노인복지관 신축공사,,,
83,서울특별시 도봉구 방학3동 구립한옥도서관,,,
84,강원도 양양군 강현면 전진리 제1종 근린생활시설(공중화장실 및 창고),,,
85,부산광역시 북구 북구 종합체육관,,,
86,울산광역시 동구 일산진마을 주민공동이용시설,,,
87,경상북도 칠곡군 칠곡교육지원청 교육지원센터,,,
88,경상남도 진주시 유등전시관,,,
89,강원도 삼척시 삼척복합체육공원 삼척시민체육관,,,
90,부산광역시 부산진구 가야2동사(청소년 문화센터),,,
91,인천광역시 부평구 인천 삼산경찰서 부개파출소,인천 부평구 부개동 501-10,37.4976979294626,126.739707355429
92,대전광역시 서구 도솔마을 주민커뮤니티마당 조성(주차장),,,
93,전라북도 순창군 세대통합형 실내놀이문화체육센터,,,
94,대전광역시 유성구 국립 대전현충원 봉안당(충혼당),,,
95,서울특별시 송파구 거암초등학교 및 거암중학교 교사,,,
96,인천광역시 미추홀구 주안5동 행정복지센터,인천 미추홀구 주안동 266-1,37.4637711198267,126.676645881955
97,경상남도 의령군 의령 전통장류 활성화센터,,,
98,전라남도 신안군 신안 문화예술회관 및 문화원 건립사업,,,
99,전라북도 남원시 반선보건진료소,전북 남원시 산내면 부운리 242-17,35.373291132164,127.579420203742
100,경상북도 경산시 경산시 동부동 행정복지센터,경북 경산시 사동 189,35.8086909689964,128.755037256515
101,"광주광역시 북구 신용 복합 공공도서관 건립공사(1종근린생활시설, 행정복지센터)",,,
102,"광주광역시 북구 신용 복합 공공도서관 건립공사(교육연구시설, 도서관)",,,
103,경상북도 성주군 성주군 성산동 고분군 전시관,경북 성주군 성주읍 성산리 822,35.9067631165283,128.299221823862
104,경기도 양평군 양근교직원공동사택,,,
105,"서울특별시 성동구 서울교통공사 5,7호선 신조전동차 336칸(우진산전)",,,
106,제주특별자치도 서귀포시 신례1리 다목적회관,,,
107,경상남도 창원시 진동면 동촌2구 경로당,,,
108,경상남도 창원시 동읍 곡목경로당,경남 창원시 의창구 동읍 화양리 620-3,35.2984910802176,128.661258312784
109,경상남도 창원시 동읍 용잠1구 여성경로당,,,
110,경기도 의정부시 거북경로당 재건축 신축공사,,,
111,전라북도 전주시 전주시 거점형 공공직장어린이집,전북 전주시 덕진구 만성동 1370-2,35.8452840700241,127.081573193323
112,광주광역시 북구 복합문화복지 커뮤니티센터,광주 북구 양산동 343-5,35.201394279442,126.87377520247
113,경상북도 영주시 영주 전통마을체험단지 마을역사자료관,,,
114,경상북도 군위군 군위군 국공립하나어린이집,,,
115,전라북도 무주군 무주군 당산리 공영주차장,,,
116,경기도 군포시 송정복합체육센터,,,
117,충청남도 논산시 사회적 경제통합 지원센터,,,
118,충청북도 음성군 중동보건진료소,충북 음성군 소이면 중동리 1059-3,36.9085140344741,127.770294818473
119,대전광역시 중구 육교경로당,대전 중구 유천동 127-78,36.3187854467088,127.401366545589
120,경상북도 구미시 반포경로당,,,
121,충청북도 진천군 이월다목적체육관 건립사업,,,
122,경상북도 칠곡군 덕천경로당,,,
123,충청남도 보령시 상생협력상가 및 청년창업지원센터,,,
124,전라남도 순천시 순천시 혁신 농업인센터,,,
125,경상남도 창원시 창원 숲 유치원,경남 창원시 마산합포구 현동 607,35.143917630776,128.556918816254
126,경상남도 창원시 창원 숲 유치원,경남 창원시 마산합포구 덕동동 607,35.1396822296194,128.575725440915
127,충청남도 서천군 서천군 가족누리센터,충남 서천군 서천읍 군사리 55-6,36.0778481114889,126.701215149598
128,충청남도 금산군 보광리 마을만들기 사업(경로당),,,
129,경기도 광주시 광주역세권 공원관리사무소,,,
130,충청남도 천안시 남산도시재생 어르신 일자리 복지센터,충남 천안시 동남구 사직동 343-145,36.7974519255639,127.149293793518
131,전라남도 여수시 화장동 시내버스공영차고지 조성공사,,,
132,서울특별시 구로구 천왕동 청소년 문화의 집,서울 구로구 천왕동 262-7,37.4839483774046,126.840185244864
133,울산광역시 울주군 울주종합체육센터,울산 울주군 서생면 신암리 689,35.3487906368656,129.318688627943
134,경상북도 포항시 흥해 복합커뮤니티센터,,,
135,부산광역시 연제구 연제구 황금로 공영주차장,부산 연제구 연산3동 1811-561,35.1705274120468,129.095229274328
136,경기도 용인시 용인동부경찰서 서천파출소,경기 용인시 기흥구 서천동 805,37.2375621717257,127.073121019671
137,경상북도 봉화군 봉화 실외테니스장 비가림 설치공사,,,
138,전라북도 장수군 장수군 종합실내체육관,,,
139,강원도 홍천군 화촌면 야시대1리 행인교 경로당,,,
140,인천광역시 부평구 인천부평경찰서 역전지구대 통합청사 신축공사,,,
141,서울특별시 양천구 구립 목3동 공원어린이집,,,
142,경상북도 봉화군 봉화 궁도장(청량정) 조성사업,,,
143,서울특별시 서초구 서초구립 서초3동 하나어린이집,,,
144,서울특별시 서초구 AI 지원센터,서울 서초구 우면동 142,37.4653806242827,127.028712869766
145,부산광역시 사하구 장림동 문화복지복합센터,부산 사하구 장림동 1137-3,35.0833867947749,128.967091498388
146,부산광역시 부산진구 부암동 신선마을 마을공유센터,,,
147,부산광역시 남구 환경공단부지 민간참여 행복주택건설사업 (인생후반전지원센터),,,
148,부산광역시 동래구 동래구 청소년수련관,,,
149,서울특별시 양천구 넘은들근린공원 숲속쉼터,,,
150,광주광역시 서구 상무시민공원 국민체육센터,,,
151,서울특별시 강남구 달터근린공원 공원관리소,,,
152,경상남도 함양군 지곡면 다목적체육관,,,
153,서울특별시 강서구 강서구 청소년상담복지센터,서울 강서구 화곡동 1071-26,37.5394557575666,126.835514184028
154,충청남도 천안시 직산파출소,충남 천안시 서북구 직산읍 삼은리 76-135,36.8783988403796,127.147774429774
155,경상북도 영천시 도계권역단위 종합정비사업 효센터,,,
156,경상북도 영천시 도계권역단위 종합정비사업 신리마을회관,,,
157,경기도 과천시 (가칭)지식1초등학교,,,
158,전라북도 순창군 음식 및 스토리마켓 신축공사 (B동),,,
159,전라북도 순창군 음식 및 스토리마켓 신축공사 (A동),,,
160,경기도 남양주시 다산진건지구 공영주차장,경기 남양주시 다산동 6148,37.6143014296102,127.154783909062
161,서울특별시 광진구 서울시 50플러스 동부캠퍼스,,,
162,경상북도 김천시 김천시 모암동 공공산후조리원 신축공사,,,
163,경기도 광명시 광덕어린이공원 내 공중화장실,,,
164,부산광역시 동래구 온천장 도시재생 뉴딜사업 혁신어울림센터 건립공사,,,
165,경상남도 산청군 생초국제조각공원 화장실,,,
166,서울특별시 동작구 신대방동 구립 지역아동센터,서울 영등포구 대림동 705,37.492678652458,126.898170489578
167,경상북도 봉화군 봉화군 농축임산물 전시판매장,,,
168,서울특별시 은평구 은평 어르신일자리 센터,서울 은평구 녹번동 11-3,37.6070539505574,126.933366669883
169,인천광역시 중구 인천중부경찰서 직장어린이집,,,
170,서울특별시 종로구 이음피움 봉제역사관,서울 종로구 창신동 647-50,37.5748030042929,127.010315251354
171,인천광역시 남동구 대구월 경로당,인천 남동구 구월동 1236-7,37.4498566479331,126.717941311139
172,경기도 오산시 오산역 환승센터 광장 공중화장실,,,
173,전라남도 곡성군 곡성군 비빌언덕25,,,
174,부산광역시 연제구 나라키움 부산통합청사,부산 연제구 거제동 501,35.1873119884943,129.073388882245
175,경상북도 문경시 문경시 보훈회관,경북 문경시 점촌동 329-1,36.5924446330986,128.201269924061
176,경상북도 영천시 완산뜨락 실버인재센터,,,
177,서울특별시 도봉구 로봇과학관,서울 도봉구 창동 1-11,37.6551418975134,127.052370535927
178,경기도 파주시 파주운정3지구 내 A-37BL 공동주택 건설공사 사회복지관,,,
179,경기도 양평군 양평헬스투어 센터,,,
180,경기도 여주시 오학동 주민센터,경기 여주시 오학동 254-1,37.3096912986226,127.644409503876
181,경기도 여주시 오학동 주민센터,경기 여주시 천송동 254-1,37.2992111147005,127.665759519539
182,경기도 여주시 오학동 주민센터,경기 여주시 현암동 254-1,37.3076950528784,127.636323722458
183,경기도 화성시 화성시 커피복합 문화센터,,,
184,전라남도 무안군 환경클린센터 공립공사,,,
185,전라북도 순창군 월드푸드 사이언스관,,,
186,광주광역시 서구 사회적가치지원센터,광주 서구 농성동 109-1,35.1529834613821,126.892000652742
187,경기도 고양시 고양향동중학교,,,
188,경기도 고양시 고양향동초등학교,,,
189,경기도 용인시 처인성 역사교육관 건립,,,
190,경기도 시흥시 목감어울림센터,경기 시흥시 조남동 697,37.3816697665075,126.85871364648
191,경상북도 영천시 최무선 역사불꽃 놀이마당 야외화장실,,,
192,대전광역시 유성구 대전복용초등학교,대전 유성구 복용동 64,36.3346993355629,127.327581004188
193,전라북도 고창군 고창군 산불대응센터,,,
194,경상북도 영주시 가흥초등학교,경북 영주시 가흥동 1857,36.8135894142263,128.609266544462
195,전라북도 군산시 군산오룡 고령자복지주택,,,
196,경상북도 영천시 임고면 농촌중심지 활성화사업(임고문화복지센터),,,
197,경상북도 청도군 덕촌 보건진료소,경북 청도군 각북면 덕촌리 649,35.7067246497985,128.582096362206
198,경기도 김포시 청룡어린이집,,,
199,경기도 안양시 박달복합청사,경기 안양시 만안구 박달동 141-2,37.4019613187896,126.904629197499
200,경기도 용인시 처인성유치원,경기 용인시 처인구 남사읍 아곡리 682,37.1566570039013,127.1725448969
201,강원도 강릉시 유천초등학교,강원 강릉시 유천동 766,37.7599201599087,128.871105403691
202,제주특별자치도 서귀포시 신효경로당,제주특별자치도 서귀포시 신효동 700-2,33.2645684723608,126.614235729975
203,경상북도 봉화군 봉화 억지춘양시장 공영주차타워,,,
204,경상북도 포항시 창포종합사회복지관(분관),,,
205,제주특별자치도 서귀포시 제주 국립산림생태관리센터 지원동,,,
206,제주특별자치도 서귀포시 제주 국립산림생태관리센터 사무동,,,
207,인천광역시 남동구 구월 1동 복합청사,인천 남동구 간석동 49-1,37.4661276816333,126.714589199352
208,"충청남도 공주시 옥룡 17, 18통 경로당",,,
209,충청북도 단양군 매포공동복지목욕탕,,,
210,충청남도 계룡시 계룡공공직장어린이집,충남 계룡시 두마면 농소리 1039,36.2584624958588,127.261792057006
211,충청북도 진천군 진천 덕산 하나 어린이집,,,
212,경상남도 양산시 이팝문화센터,,,
213,서울특별시 강북구 서울번동3 고령자복지주택 주민복지관,,,
214,제주특별자치도 서귀포시 미래농업육성관,,,
215,강원도 영월군 영월주천 고령자복지주택,,,
216,충청북도 영동군 추풍령면소재지 종합정비사업 공중화장실,,,
217,강원도 삼척시 도계읍 복합교육연구관,강원 삼척시 도계읍 전두리 24-3,37.2333835122109,129.042285375024
218,경기도 화성시 시립반월하나어린이집,경기 화성시 반월동 862,37.2308327137941,127.062738924849
219,충청남도 보령시 석서골 노인회관,충남 보령시 신흑동 766-94,36.3199935604426,126.516283545142
220,경상북도 칠곡군 천왕사랑방,,,
221,전라남도 고흥군 고흥반다비 국민체육센터 건립공사,,,
222,인천광역시 남동구 인천구월A-3BL 공공임대주택 건설사업,,,
223,전라북도 임실군 임실군 거점형 공공 직장어린이집,전북 임실군 임실읍 이도리 745-1,35.6151213157812,127.279709999765
224,충청남도 서산시 비점오염저감시설 공중화장실(부장리),,,
225,경상북도 상주시 거꾸로 옛이야기 나라숲 조성사업 이야기 공작소,,,
226,경상북도 상주시 화북대형주차장화장실,충북 보은군 속리산면 사내리 292-4,36.5262388123067,127.819214461566
227,충청북도 보은군 연꽃화장실,,,
228,경기도 성남시 위례동 행정복지센터,경기 성남시 수정구 창곡동 508-1,37.4713252969783,127.142295769358
229,경기도 성남시 수내도서관 건립공사,,,
230,전라남도 목포시 한국해양수산연수원 목포분원,전남 목포시 죽교동 695-3,34.7964378342685,126.357763731745
231,충청북도 청주시 화학물질안전원 신청사 및 교육훈련장,,,
232,경상북도 봉화군 봉화군 선거관리위원회,경북 봉화군 봉화읍 내성리 350-1,36.8931802222833,128.740099073383
233,경상북도 김천시 운남중학교,경북 김천시 율곡동 370,36.1218018221774,128.179106216176
234,대구광역시 동구 효목2동 어린이공원 & 공용주차장,대구 동구 신천동,35.8719700892442,128.626843791513
235,대구광역시 동구 효목2동 어린이공원 & 공용주차장,대구 동구 신천1.2동,35.8700151958924,128.614647426814
236,대구광역시 동구 효목2동 어린이공원 & 공용주차장,대구 동구 신천3동,35.8752751668421,128.623669460702
237,대구광역시 동구 효목2동 어린이공원 & 공용주차장,대구 동구 신천4동,35.8717492746518,128.62930603461
238,대구광역시 수성구 고산노인복지관 별관,대구 수성구 신매동 170-1,35.8367137654733,128.712680976703
239,대구광역시 남구 배나무샘골 마을문화센터,,,
240,울산광역시 동구 해양수산복합공간 (방어진 활어센터),,,
241,충청남도 서산시 내포관광 창조지원센터,,,
242,제주특별자치도 서귀포시 하원 마을회관,제주특별자치도 서귀포시 하원동 480-4,33.2567262858365,126.461054249361
243,경상북도 성주군 가야산국립공원 백운분소,경북 성주군 수륜면 백운리 1805,35.800777392793,128.141592987849
244,강원도 삼척시 삼척번개시장 공중화장실,강원 삼척시 사직동 60-12,37.4310174199108,129.177708101888
245,충청남도 계룡시 계룡 병영체험관,,,
246,강원도 삼척시 도계전두시장 공중화장실,,,
247,경기도 화성시 서연고등학교,경기 화성시 장지동 973,37.1608132791366,127.111616830562
248,울산광역시 북구 시니어행복나눔센터,,,
249,인천광역시 미추홀구 용현2동 행정복지센터,인천 미추홀구 용현동 611-6,37.4526285960013,126.640315141579
250,전라남도 강진군 보은산 힐링센터,,,
251,전라남도 영암군 학산 소규모 도서관,,,
252,전라북도 부안군 돌팍거리 공영주차장 건립공사,,,
253,경기도 광명시 광명시 평생학습원,경기 광명시 하안동 718-2,37.4667802726489,126.869519027745
254,인천광역시 계양구 계양여성회관 부근 주차장,인천 계양구 효성동 293-8,37.5290549191866,126.717879471174
255,전라북도 고창군 동호항 체험센터 및 마을전시관,,,
256,경상남도 창원시 내서 어린이체육관,경남 창원시 마산회원구 양덕동 18-16,35.2305305906401,128.584609080503
257,전라남도 여수시 전남해양수산과학원 여수지원 청사 건립,,,
258,경기도 양주시 곰두리어린이집,경기 양주시 삼숭동 640-45,37.8013930670468,127.09060187523
259,경기도 시흥시 계수8통 경로당,경기 시흥시 계수동 179-33,37.4529536134104,126.817465982169
260,경기도 성남시 태평종합사회복지관,,,
261,경기도 평택시 평택경찰서 송탄지구대,경기 평택시 신장동 211-7,37.0817894765044,127.056021821368
262,충청북도 청주시 청주동남지구 수변공원18호 공중화장실,,,
263,충청북도 청주시 청주동남지구 근린공원98호 관리사무실(공중화장실겸용),,,
264,충청남도 서산시 비점오염저감시설 공중화장실(용암리),,,
265,대전광역시 서구 도안동 행정복지센터,대전 서구 가수원동 761-3,36.3035739762614,127.349355243769
266,대전광역시 서구 도안동 행정복지센터,대전 서구 괴곡동 761-3,36.2814283726552,127.353519974922
267,충청남도 서산시 해오름 체육관,,,
268,서울특별시 은평구 가칭)구립 성가정어린이집,,,
269,인천광역시 계양구 계양구 청소년 문화의 집,인천 계양구 효성동 266-9,37.5286815534166,126.715217510939
270,제주특별자치도 제주시 탑동광장관리사무소,제주특별자치도 제주시 건입동 1444,33.5181038904109,126.526602474608
271,인천광역시 서구 한들근린4구역 공중화장실,,,
272,인천광역시 서구 한들근린3구역 공중화장실,,,
273,인천광역시 서구 한들근린1구역 공중화장실,,,
274,강원도 평창군 평창종부 고령자복지주택,,,
275,부산광역시 금정구 회동동 복합커뮤니티 문화센터,부산 금정구 회동동 200-3,35.2266292550951,129.116467467996
276,경기도 화성시 매향리 평화생태공원 안내센터,,,
277,전라북도 고창군 고창율계 고령자복지주택,,,
278,전라북도 장수군 장수 가야역사관 건립공사,,,
279,경상남도 함안군 함안 역사문화체험파크,경남 함안군 가야읍 도항리 718,35.2682938414678,128.40219640795
280,전라남도 구례군 도시재생 통합어울림센터 건립사업,,,
281,인천광역시 남동구 만부마을 도시재생 뉴딜사업 사랑방,,,
282,강원도 홍천군 홍천북방 고령자복지주택,,,
283,인천광역시 강화군 내4리 경로당,,,
284,강원도 동해시 동해 꿈빛마루 도서관,,,
285,경상북도 구미시 구미시 육아종합지원센터,경북 구미시 산동읍 신당리 2017,36.1530462451986,128.431648866517
286,울산광역시 북구 상안유치원 별관동,,,
