index,title,address,lat,lon
1723,전라북도 정읍시 정읍시 태인면농업인상담소,전북 정읍시 태인면 태성리 635,35.6554668279411,126.934662254283
1724,전라남도 나주시 나주시 진산요양원 증축동(남자생활관),,,
1725,강원도 동해시 북평2통 경로당,,,
1726,전라북도 부안군 보안면 수랑마을 공중화장실 설치공사,,,
1727,경상남도 합천군 대병면 노인회관,경남 합천군 대병면 성리 1249-7,35.5237017051301,128.04928402234
1728,부산광역시 수영구 수영구 스포츠문화타운,부산 수영구 광안동 1333,35.1527828475919,129.107513298584
1729,경상북도 영덕군 영덕군 청소년수련관 건립공사,,,
1730,전라북도 남원시 반선보건진료소,전북 남원시 산내면 부운리 242-17,35.373291132164,127.579420203742
1731,인천광역시 계양구 갈현체육공원,인천 계양구 다남동 42-8,37.565366825238,126.720553497438
1732,인천광역시 연수구 (가칭)해양3중학교,,,
1733,충청남도 서산시 서산시 도로시설관리소,,,
1734,강원도 홍천군 동면 신봉리 경로당,강원 홍천군 동면 신봉리 211-8,37.6889471467873,127.970818557778
1735,서울특별시 강남구 세곡 커뮤니티센터,서울 강남구 세곡동 521-1,37.4610628315724,127.102703641522
1736,인천광역시 연수구 인천아암초등학교,인천 연수구 송도동,37.3910698289609,126.652089783488
1737,인천광역시 연수구 인천아암초등학교,인천 연수구 송도3동,37.3698984232225,126.656667188191
1738,인천광역시 연수구 인천아암초등학교,인천 연수구 송도1동,37.3910447602502,126.652144103433
1739,인천광역시 연수구 인천아암초등학교,인천 연수구 송도2동,37.403278225614,126.641701271832
1740,인천광역시 연수구 인천아암초등학교,인천 연수구 송도4동,37.3880627741626,126.634935217348
1741,인천광역시 연수구 인천아암초등학교,인천 연수구 송도5동,37.4138925571559,126.623269960972
1742,경기도 의왕시 부곡도깨비시장 공영주차장 조성공사,,,
1743,강원도 홍천군 서면 생활체육공원 다목적실,,,
1744,인천광역시 부평구 청천2구역 공공시설(보육시설),,,
1745,경기도 화성시 화성동탄경찰서 동탄3지구대,경기 화성시 목동 252-1,37.181288246293,127.122467788874
1746,제주특별자치도 제주시 한경면 종합복지회관,제주특별자치도 제주시 한경면 고산리 2904-3,33.300397846886,126.183832037065
1747,경기도 파주시 조리읍 행정복지센터,경기 파주시 조리읍 봉일천리 125-17,37.7433383378906,126.809771263655
1748,경기도 화성시 새솔초등학교,경기 화성시 새솔동 12,37.2888426877944,126.819102767367
1749,제주특별자치도 서귀포시 말문화시설(헌마공신 김만일기념.전시관),,,
1750,경기도 의정부시 (가칭)고산유치원,,,
1751,충청북도 충주시 충주 이야기가 있는 사과나무마을 어울림센터 신축공사,,,
1752,충청남도 홍성군 결성면 오거리 휴게광장 공중화장실,,,
1753,전라남도 영암군 영암 파크골프장 관리동,,,
1754,경기도 시흥시 계수8동 경로당 건립공사,,,
1755,경기도 하남시 (가칭)감일1유치원,,,
1756,충청남도 공주시 꿈든솔,,,
1757,인천광역시 강화군 신문리 대안경로당,인천 강화군 강화읍 신문리 122-1,37.7465210830322,126.484934798996
1758,경기도 의정부시 도봉산~옥정 광역철도 2공구 건설공사 103정거장,,,
1759,서울특별시 강동구 암사1동 구립 어린이집,서울 강동구 암사동 468-4,37.5522704053174,127.131064547751
1760,서울특별시 용산구 용문동 주민커뮤니티센터,서울 용산구 용문동 38-191,37.5369365173523,126.958251053676
1761,경기도 안양시 안양8동 명학마을 스마트케어하우스 신축공사,,,
1762,제주특별자치도 제주시 한수리 마을복지관,,,
1763,충청북도 괴산군 감물면 농촌중심지 활성화사업 공중화장실,,,
1764,강원도 삼척시 삼척 치유의 숲(힐링센터),,,
1765,서울특별시 서초구 서초4동 복합주민센터,,,
1766,강원도 삼척시 삼척 치유의 숲 방문자센터,,,
1767,경기도 화성시 화성시 농업기술교육장,,,
1768,경상남도 양산시 양산 독립공원 기념관,경남 양산시 북부동 691-8,35.3484997264477,129.039206866372
1769,강원도 원주시 봉대가온학교,강원 원주시 반곡동 300-1,37.332347191568,127.994013445891
1770,강원도 원주시 원주경찰서 부론파출소,강원 원주시 부론면 법천리 1449-2,37.2093164413477,127.750052071616
1771,경상남도 양산시 금오초중학교,경남 양산시 동면 석산리 1448-1,35.3220023847161,129.027870944808
1772,경상남도 창원시 내서 스포츠센터,경남 창원시 마산회원구 내서읍 중리 391-3,35.249941309421,128.52158315936
1773,경기도 안산시 월피 예술도서관 건립공사,,,
1774,경기도 남양주시 남양주다산고등학교,경기 남양주시 다산동 6050,37.6255675474621,127.158518756113
1775,강원도 태백시 국립공원공단 태백산국립공원사무소,,,
1776,서울특별시 동대문구 서울바이오허브 지역열린동,,,
1777,경기도 고양시 향동공원 화장실(체육공원),,,
1778,경기도 고양시 꿀내음공원 화장실(어린이공원2호),,,
1779,강원도 강릉시 강릉시 장애인 직업재활시설(사랑의 일터),,,
1780,인천광역시 서구 가칭)검단2초등학교 신축공사,,,
1781,충청남도 홍성군 홍성일반산업단지 근로자복지센터,,,
1782,경기도 성남시 성남 컬쳐플랫폼,경기 성남시 수정구 태평동 3678,37.4416352638415,127.133229003707
1783,경기도 남양주시 (가칭)백봉초중 통합학교 신축공사,,,
1784,서울특별시 송파구 잠실본동 복합청사 신축공사,,,
1785,제주특별자치도 제주시 상가리 경로당,제주특별자치도 제주시 애월읍 상가리 1196-1,33.4497969782966,126.345662852197
1786,경기도 화성시 매화리 오토캠핑장,,,
1787,서울특별시 중랑구 (가칭)양원초 교사신축,,,
1788,대구광역시 수성구 대구시체육회관,대구 수성구 대흥동 504,35.8277916223016,128.685163676326
1789,경상남도 산청군 산청유치원,경남 산청군 산청읍 지리 300,35.412232223089,127.879584360965
1790,강원도 홍천군 홍천군 궁도장,강원 홍천군 홍천읍 태학리 302-2,37.7116226169994,127.906147107933
1791,경기도 의왕시 의왕역 환승주차장,경기 의왕시 삼동 193-13,37.3204530972083,126.94895728203
1792,서울특별시 서초구 서초구립 방배본동 신나는 어린이집,서울 서초구 방배동 789-18,37.4922345174157,126.985865147935
1793,충청남도 보령시 성주면 대형주차장 내 공중화장실 신축공사,,,
1794,경상남도 거창군 2020년도 국가지정문화재 보수정비사업 거창 당산리 당송 주변정비사업,,,
1795,경상남도 창녕군 창녕오리정운동장,경남 창녕군 창녕읍 술정리 374-4,35.540436423833,128.488054440774
1796,경기도 평택시 평택로컬푸드 종합센터,경기 평택시 오성면 숙성리 84-2,37.012974618535,126.982685844847
1797,경상북도 경주시 경주시 장애인기초재활교육센터,,,
1798,전라남도 영암군 월출산국립공원사무소 신축공사,,,
1799,강원도 춘천시 석사동 행정복지센터,강원 춘천시 석사동 665,37.8586207817831,127.74236181414
1800,경기도 안양시 매곡어린이집,경기 안양시 동안구 비산동 318-79,37.4044578203315,126.944917656324
1801,경상북도 의성군 단촌구계 보건진료소,경북 의성군 단촌면 구계리 663,36.461869435788,128.724367607638
1802,대전광역시 유성구 유성구 하기동 여가녹지 화장실 및 관리사무소,,,
1803,충청북도 증평군 보강천 화장실,,,
1804,경상북도 의성군 생송 보건진료소,경북 의성군 단밀면 생송리 230-5,36.3751154009566,128.350389023922
1805,경기도 의왕시 의왕시 백운밸리 마을회관,,,
1806,경상남도 진주시 문산읍 관정마을 경로당,경남 진주시 문산읍 소문리 112-6,35.1704688979879,128.169142737286
1807,경상북도 영천시 영천시 말문화복합센터,,,
1808,대구광역시 서구 비산4동 어린이집,대구 서구 비산동 223-4,35.87008046095,128.573596916316
1809,충청북도 보은군 속리산 휴양관광지 모노레일시설 설치사업,,,
1810,경기도 평택시 근15호 동말 근린공원 화장실,,,
1811,경기도 평택시 근3호 아홉거리 근린공원 화장실,,,
1812,경기도 평택시 송탄졸음쉼터(제천방향) 공중화장실,,,
1813,경기도 평택시 송탄졸음쉼터(평택방향) 공중화장실,,,
1814,강원도 태백시 태백 매봉산 산악관광 조성사업 치유의 숲(치유센터 및 숲속의 집),,,
1815,충청북도 음성군 한국과학기술평가원,충북 음성군 맹동면 두성리 1521,36.9041498423172,127.549524888418
1816,제주특별자치도 제주시 저지오름 보전관리 정보센터,,,
1817,광주광역시 동구 전일빌딩 245,광주 동구 금남로1가 1-1,35.1483354592155,126.918848706573
1818,전라남도 구례군 산동면소재지 종합정비사업 공용화장실,,,
1819,전라북도 군산시 수산기술연구소 수산질병센터 청사 신축공사,,,
1820,인천광역시 강화군 지혜의 숲 도서관,인천 강화군 선원면 창리 606-26,37.7220090243887,126.483602489814
1821,부산광역시 영도구 영도구 Sea-Side Complex Town,,,
1822,제주특별자치도 제주시 올레20코스 안내소,,,
1823,전라남도 장흥군 장흥군 선거관리위원회,전남 장흥군 장흥읍 건산리 752-1,34.6769995395259,126.907061729395
1824,경상남도 창원시 자은동 민원센터,경남 창원시 진해구 자은동 147,35.1537885214702,128.71316945803
1825,경기도 화성시 화성우체국,경기 화성시 병점동 383-1,37.2072775756667,127.034102376977
1826,전라남도 무안군 행복유치원 신축공사,,,
1827,강원도 동해시 동해 북평레포츠 복합시설 건립공사,,,
1828,경기도 의정부시 의정부시 통합보훈회관,,,
1829,서울특별시 송파구 거암유치원,서울 송파구 거여동 443,37.4843997278492,127.147597918029
1830,제주특별자치도 제주시 신양항 공중화장실,제주특별자치도 제주시 추자면 신양리 434-9,33.9452246743488,126.327513739927
1831,충청북도 보은군 보은산업단지 기업지원시설,,,
1832,경상남도 창원시 가곡경로당,경남 창원시 의창구 동읍 본포리 456,35.3590069498599,128.644403999673
1833,강원도 춘천시 강원디자인진흥원,강원 춘천시 후평동 244-40,37.8899925022185,127.746580410642
1834,경기도 화성시 송산1유치원,경기 화성시 송산동 148-6,37.2093603465616,127.015016723895
1835,충청남도 예산군 함께하는 실버키즈 100세 공동체 활성화 사업,,,
1836,강원도 원주시 원주시 노인종합복지관 문막분관,강원 원주시 태장동 1052-1,37.3825071321365,127.952041832206
1837,경상남도 함양군 지곡면 다목적체육관 건립사업,,,
1838,서울특별시 양천구 갈산문화복합시설,,,
1839,경기도 평택시 평택경찰서 송탄파출소,,,
1840,서울특별시 도봉구 서울북부광역등기소,,,
1841,경기도 화성시 (가칭)병점1초등학교,,,
1842,경기도 화성시 (가칭)동탄20유치원,,,
1843,서울특별시 종로구 정부 서울청사 창성동별관,서울 종로구 창성동 117-6,37.5797077748414,126.973228535753
1844,광주광역시 광산구 광산경찰서 월곡지구대,광주 광산구 월곡동 680-2,35.1794753864659,126.809157038381
1845,경상북도 울진군 울진군 농어촌놀이터,,,
1846,대구광역시 수성구 파동우체국,대구 수성구 파동 495,35.8096332392093,128.619106010112
1847,울산광역시 울주군 발효아케데미관,,,
1848,경기도 오산시 경기 아이드림 오산센터,,,
1849,부산광역시 중구 자갈치글로벌수산명소화,,,
1850,전라남도 보성군 동화나라어린이집,전남 보성군 보성읍 주봉리 418-1,34.7641587086507,127.071779445033
1851,경기도 남양주시 (가칭)진건3유치원,,,
1852,경상남도 창원시 원계근린공원 내 화장실,,,
1853,전라남도 화순군 화순 동복 연둔리 숲정이 화장실,,,
1854,경상북도 상주시 상주시 육아종합지원센터,경북 상주시 무양동 164-23,36.4207405587322,128.154584076586
1855,경상남도 김해시 김해서부경찰서 율하파출소,경남 김해시 장유동 844,35.1697070809729,128.823460873506
1856,인천광역시 연수구 인천대학교 송도신캠퍼스 도서관(IT도서관) 증축,,,
1857,경기도 고양시 고양경찰서 도래울파출소,,,
1858,인천광역시 옹진군 연평면 주민체육시설,,,
1859,강원도 강릉시 강릉소방서 공동 직장어린이집,,,
1860,경상남도 통영시 경상남도 수산물안전관리센터,,,
1861,강원도 평창군 현충탑 화장실,,,
1862,부산광역시 동구 동구 만화체험관,부산 동구 범일동 1405-1,35.1377998198616,129.049835109475
1863,대구광역시 수성구 수성구 중동 치안센터,,,
1864,충청남도 홍성군 옥암어린이공원 공중화장실,,,
1865,제주특별자치도 제주시 올레14코스 안내소,제주특별자치도 제주시 한경면 저지리 1843-2,33.3336678972089,126.256108039246
1866,전라북도 군산시 전주출입국관리사무소 군산출장소 신축공사,,,
1867,제주특별자치도 서귀포시 대포항 공중화장실,,,
1868,울산광역시 북구 고헌중학교,울산 북구 화봉동 1485-1,35.5976426148641,129.363950383961
1869,울산광역시 중구 동백시니어센터,울산 중구 학성동 139-2,35.553469824834,129.337603027769
1870,인천광역시 부평구 부평구 십정동 어린이집,인천 부평구 십정동 324-1,37.4750630300372,126.695342097004
1871,서울특별시 구로구 신안산선 복선전철 민간투자사업(구로디지털단지 정거장),,,
1872,서울특별시 영등포구 신안산선 복선전철 민간투자사업(영등포 정거장),,,
1873,서울특별시 영등포구 신안산선 복선전철 민간투자사업(신풍 정거장),,,
1874,서울특별시 영등포구 신안산선 복선전철 민간투자사업(여의도 정거장),,,
1875,경기도 파주시 야당역 환승주차장,경기 파주시 야당동 1087,37.714280985252,126.761686118948
1876,강원도 인제군 상남3리 경로당,강원 인제군 상남면 상남리 1509-4,37.8453168765111,128.241681428392
1877,제주특별자치도 제주시 금능리 복합문화복지센터,,,
1878,광주광역시 북구 헬스케어로봇실증센터,광주 북구 월출동 987,35.2384871290531,126.866426603149
1879,서울특별시 동대문구 서울시립대 미래융합관,,,
1880,대구광역시 남구 대구대표도서관,,,
1881,서울특별시 은평구 제2남도학숙,,,
1882,강원도 고성군 봉포리 아름다운 해풍거리 조성사업(관리사무소),,,
1883,경기도 연천군 연천경찰서 전곡파출소,경기 연천군 전곡읍 전곡리 328-40,38.0255401044106,127.07353409086
1884,전라북도 장수군 호덕 마을만들기사업,,,
1885,강원도 삼척시 성내지구 대학로 주차타워,,,
1886,충청북도 충주시 충청강원 119특수구조대,충북 충주시 주덕읍 화곡리 1107,37.0135952743212,127.809584005585
1887,전라남도 여수시 여수신북항 관리사무실 및 운영사무실,,,
1888,전라남도 완도군 해양기후 치유센터,,,
1889,경기도 안산시 신안산선 복선전철 민간투자사업(성포정거장),,,
1890,경상남도 산청군 지리산국립공원 삼장분소,경남 산청군 삼장면 평촌리 658,35.3506906155802,127.816954103341
1891,제주특별자치도 서귀포시 서귀포 치유의숲 내 임산물판매장 및 야외화장실,,,
1892,제주특별자치도 제주시 강구리새마을회 경로당,,,
1893,충청남도 금산군 금산 상리지구 공영주차타워,,,
1894,경기도 광명시 빛가온중학교,경기 광명시 일직동 527,37.4119459406514,126.884028760505
1895,전라남도 나주시 영강동 어울림센터 건립공사,,,
1896,경상북도 영덕군 영덕목재문화체험장 조성사업 창포말 색동나무누리 신축공사,,,
1897,전라남도 화순군 국제규격 천연물의약품원료 대량생산시설,,,
1898,경기도 화성시 화성시 동탄호수공원 어울림센터,경기 화성시 산척동 726,37.1705690460453,127.11062816575
1899,부산광역시 금정구 금정문화원,부산 금정구 구서동 83-3,35.2472990916027,129.093176747178
1900,경기도 화성시 서해선 복선전철 105역사,,,
1901,경기도 화성시 서해선 복선전철 104역사,,,
1902,경기도 평택시 서해선 복선전철 103역사,,,
1903,충청남도 당진시 서해선 복선전철 101역사,,,
1904,전라북도 부안군 부안군 보안면 청사 신축공사,,,
1905,경상남도 창원시 월영 경로당,경남 창원시 마산합포구 월영동 602-48,35.1772917143215,128.555780993044
1906,충청남도 아산시 제12호 근린공원 관리사무소,,,
1907,경상남도 창원시 내서문화의집 별관,,,
1908,충청남도 아산시 제10호 근린공원 관리사무소,,,
1909,서울특별시 광진구 군자동 복합청사 건립,,,
1910,"전라남도 담양군 전라남도 1000년! 새로운 시작, 순담 Meta-Circle 프로젝트",,,
1911,대구광역시 중구 대구행복기숙사,대구 중구 수창동 29-1,35.875105290592,128.589496957276
1912,경상북도 상주시 모서면 연화사 공중화장실,,,
1913,경상북도 포항시 이동 제4공원 공영주차장,,,
1914,제주특별자치도 서귀포시 서귀포 사려니 숲 내 야외(포세식)화장실,,,
1915,제주특별자치도 제주시 삼양동 선사유적지 주차장 관리사무소,,,
1916,충청남도 청양군 청양군 장애인회관,충남 청양군 청양읍 교월리 106-1,36.4504853619053,126.811081449282
1917,경기도 남양주시 다산한강초등학교,경기 남양주시 다산동 6236,37.5993182588118,127.172396282479
1918,경상북도 성주군 성주군 청년창업 LAB 조성사업,,,
1919,경기도 안산시 안산산업역사박물관,경기 안산시 단원구 초지동 667,37.3268455747838,126.813908652466
1920,경기도 안산시 안산산업역사박물관,경기 안산시 단원구 성곡동 667,37.3202912774805,126.743053138427
1921,울산광역시 북구 육아종합지원센터,울산 북구 연암동 1120-3,35.584589992693,129.361169922493
1922,경기도 수원시 정자동 장애인주간보호시설,경기 수원시 장안구 정자동 43-17,37.2925132337821,126.997602445997
1923,경기도 시흥시 목감고등학교,경기 시흥시 조남동 683,37.3721252356669,126.857303172303
1924,경기도 안양시 안양만안경찰서 안양지구대,경기 안양시 만안구 안양동 88-1,37.406224096723,126.919210526904
1925,충청북도 청주시 세종대왕 행궁,,,
1926,강원도 철원군 철원국민체육센터,강원 철원군 갈말읍 군탄리 1382-6,38.1587140071637,127.302692549668
1927,경상남도 밀양시 영남알프스 생태관광센터,,,
1928,부산광역시 동래구 (가칭)온천2초등학교,,,
1929,경기도 수원시 씽씽어린이공원 화장실,,,
1930,서울특별시 서초구 방배1파출소,서울 서초구 방배동 906-5,37.4845317949784,126.996904583848
1931,전라남도 여수시 양지바름공원 화장실 신축사업,,,
1932,전라남도 여수시 차동공원 화장실 신축사업,,,
1933,경기도 광명시 신안산선 복선전철 민간투자사업(광명정거장),,,
1934,경기도 안산시 신안산선 복선전철 민간투자사업(호수정거장),,,
1935,경기도 안산시 신안산선 복선전철 민간투자사업(한양대정거장),,,
1936,광주광역시 남구 119소방안전교육센터,광주 광산구 우산동 1602-2,35.1590141808014,126.806285116368
1937,경상남도 산청군 남부문화체육센터,경남 산청군 신안면 하정리 930-1,35.3013228094894,127.971179349235
1938,경상남도 사천시 사천파출소,경남 사천시 사천읍 평화리 51,35.0831906380465,128.087771906542
1939,전라북도 완주군 용진읍 행정복지센터,전북 완주군 용진읍 용흥리 860,35.8801974318845,127.156134729112
1940,경상남도 김해시 경남콘텐츠 기업육성센터,경남 김해시 관동동 1052-1,35.1768208639601,128.80529392212
1941,서울특별시 동작구 상도제4동주민센터,서울 동작구 상도동 437,37.4981089873804,126.953074872495
1942,경상북도 칠곡군 칠곡군 중증장애인자립지원센터 · 가족지원센터,,,
1943,경기도 김포시 고촌 노을주차장,경기 김포시 고촌읍 신곡리 1103,37.605466082995,126.772935715982
1944,경상북도 포항시 포항북부경찰서 양학파출소,,,
1945,경상북도 영덕군 영덕군 보훈회관,경북 영덕군 영덕읍 남석리 6,36.410566129828,129.370086752423
1946,충청남도 천안시 천안 성정동 어린이공원 지하주차장 및 공중화장실,,,
1947,대구광역시 동구 국가정보자원관리원 대구센터,대구 동구 도학동 448,35.9684565349174,128.706353856756
1948,부산광역시 연제구 부산연제경찰서 연산파출소,,,
1949,전라남도 함평군 전라남도 함평교육지원청,전남 함평군 함평읍 기각리 373-34,35.0674654609781,126.522995270678
1950,경기도 광명시 광명경찰서 일직파출소,,,
1951,경기도 고양시 꽃향기공원 화장실,,,
1952,경기도 고양시 숲향기공원 화장실,,,
1953,전라남도 영암군 삼호 실내수영장,전남 목포시 옥암동 1373,34.8026790651015,126.440283243967
1954,서울특별시 광진구 자양1재정비촉진구역 도시정비형 재개발사업(공공청사),,,
1955,경상북도 경주시 황남동 포석로 공용주차장(공중화장실),,,
1956,전라남도 여수시 상하화보건진료소,전남 여수시 화정면 하화리 236,34.5943132542497,127.62005347345
1957,경기도 수원시 만석공원 맹꽁이화장실,,,
1958,부산광역시 해운대구 송정동경로당,,,
1959,충청남도 천안시 천안삼거리공원 화장실,,,
1960,충청남도 천안시 천안삼거리공원 체험공방,,,
1961,충청남도 천안시 천안삼거리공원 판매시설,,,
1962,충청남도 천안시 천안삼거리공원 지하주차장,,,
1963,경상남도 창원시 창원시 팔룡동 공영주차빌딩,,,
1964,경상남도 진주시 대곡중학교,경남 진주시 충무공동 128,35.1705896275696,128.136342596591
1965,전라남도 화순군 호남119특수구조대,전남 화순군 이양면 율계리 815-4,34.8722958472808,126.99524946858
1966,경기도 군포시 군포시 보훈회관,경기 군포시 산본동 1096-6,37.364718470201,126.933569814575
1967,인천광역시 남동구 남촌 어울림 커뮤니티센터,인천 남동구 남촌동 376-10,37.4329354753113,126.716029104962
1968,경기도 성남시 복정도서관 건립공사,,,
1969,강원도 춘천시 구곡폭포 특산물 판매장,,,
1970,"대구광역시 남구 강당골 스포츠클라이밍장 조성사업 부대시설(사무소,화장실,샤워장) 및 휴게음식점",,,
1971,"제주특별자치도 서귀포시 어촌·어항(신천항) 관광특성화사업(목욕탕, 소매점)",,,
1972,경기도 의정부시 의정부역 동부광장 역전근린공원 화장실,,,
1973,충청북도 진천군 진천군 육아종합지원센터,충북 진천군 덕산읍 두촌리 2749,36.8992759611961,127.528429030355
1974,충청남도 아산시 방축동 제1공영주차장,충남 아산시 온천동 1926,36.7928766314766,126.996512255557
1975,전라남도 광양시 광양 중마수영장 건립공사,,,
1976,경상북도 영천시 부향마을 경로당,,,
1977,전라북도 전주시 전주양현중학교,전북 전주시 덕진구 만성동 1357-1,35.8476285001152,127.074943858966
1978,경기도 파주시 가람마을공원 지하주차장,,,
1979,경상북도 고령군 개진면 노인회관 경로당,경북 고령군 개진면 직리 804-6,35.7225699567001,128.308492527802
1980,경상북도 구미시 구미경찰서,경북 구미시 신평동 188-2,36.118018342584,128.36448325241
1981,서울특별시 중랑구 중랑구 방정환 교육지원센터,서울 중랑구 상봉동 99-1,37.5974436342788,127.088310533115
1982,경상북도 봉화군 봉화경찰서 명호파출소,경북 봉화군 명호면 도천리 240-7,36.8560395948339,128.898100048915
1983,경상북도 청송군 청송경찰서 안덕파출소,경북 청송군 안덕면 명당리 455,36.290031489426,128.961209008861
1984,경상북도 영주시 장수면농촌중심지활성화사업 다목적체육관,,,
1985,제주특별자치도 제주시 제주보육원 신축공사,,,
1986,제주특별자치도 제주시 신창항 다이버 체험학습장 지원센터,,,
1987,전라남도 나주시 종자관리소청사(행정동) 건립공사,,,
1988,전라남도 보성군 겸백남성경로당 신축공사,,,
1989,서울특별시 영등포구 국회소통관,서울 영등포구 여의도동 1,37.5310586079353,126.915381487445
1990,전라북도 부안군 부안경찰서 보안파출소,전북 부안군 보안면 영전리 513-20,35.6114946096083,126.668540933517
1991,광주광역시 남구 광주광역시 남구 치매안심센터,광주 남구 노대동 737,35.1062290121958,126.903776403372
1992,전라남도 목포시 유달산 목재문화체험장,,,
1993,경기도 평택시 오성면 행정복지센터 건립공사,,,
1994,경상북도 상주시 도림사 공중화장실,,,
