index,title,address,lat,lon
2803,경기도 오산시 오산시 소리울도서관,경기 오산시 원동 481-17,37.1326319223431,127.074976337391
2804,전라북도 익산시 웅포보건지소,전북 익산시 웅포면 웅포리 898-1,36.0657219532812,126.878197895856
2805,경기도 양주시 남면 신산시장 복합센터 건립공사,,,
2806,강원도 홍천군 두촌면 농촌중심지활성화사업 복지회관,,,
2807,전라남도 나주시 빛고을 정신요양원 남자생활관,,,
2808,전라북도 고창군 세이브더칠드런 고창 농어촌 놀이터,,,
2809,전라남도 순천시 낙안보건지소,전남 순천시 낙안면 동내리 202,34.9079837255343,127.346379887683
2810,전라북도 완주군 혁신도시 소리공원내 여성전용 공중화장실,,,
2811,전라북도 전주시 전주시 아동청소년센터,전북 전주시 완산구 효자동1가 545-3,35.8059802313581,127.120314045765
2812,전라남도 여수시 남면 역포대합실 신축공사,,,
2813,강원도 홍천군 홍천 무궁화수목원 방문자센터,,,
2814,전라남도 여수시 여자중계민원처리소,,,
2815,경기도 남양주시 (가칭)녹촌유치원,,,
2816,경상북도 영양군 일월면분회 경로당,,,
2817,경기도 수원시 고등동 행정복지센터,경기 수원시 팔달구 고등동 153-1,37.2734126617997,127.001111713104
2818,경기도 여주시 북내 실내체육관,경기 여주시 북내면 당우리 40-2,37.3344915669679,127.676918992438
2819,경상남도 고성군 고성향토역사관,,,
2820,충청북도 증평군 증평군 보훈회관,충북 증평군 증평읍 증평리 482,36.7817162257765,127.58607577146
2821,전라남도 담양군 외추보건진료소,전남 담양군 금성면 외추리 98,35.3208279024254,127.031387073821
2822,인천광역시 미추홀구 모퉁이보호작업장,인천 미추홀구 숭의동 161-26,37.4646005787767,126.645000322431
2823,부산광역시 사상구 부산사상경찰서 학장파출소,,,
2824,경상북도 상주시 화북면 중벌리 체육공원 공중화장실,,,
2825,대구광역시 동구 내동경로당,대구 동구 내동 212-3,35.9700085214686,128.660289043116
2826,경기도 평택시 신촌지구 근린공원 공중화장실,,,
2827,경기도 평택시 신촌지구 체육공원 공중화장실,,,
2828,충청북도 영동군 영산동 공영주차장 복층화사업,,,
2829,인천광역시 강화군 강화고인돌체육관,인천 강화군 강화읍 국화리 46-2,37.7549549358487,126.468553923841
2830,울산광역시 북구 북구 노인회관,울산 북구 화봉동 450-1,35.5885552282386,129.3678398342
2831,경기도 오산시 삼미초등학교,경기 오산시 외삼미동 290-3,37.1912307719777,127.060267985487
2832,경기도 오산시 화양면사무소,,,
2833,경기도 양주시 (가칭)옥정1고등학교,,,
2834,경기도 시흥시 (가칭)목감1유치원,,,
2835,세종특별자치시  (가칭) 해밀중고등학교,,,
2836,세종특별자치시  (가칭) 해밀초등학교,,,
2837,경기도 의왕시 부곡동 청소년 문화의 집,경기 의왕시 삼동 628,37.3177262575199,126.957266328843
2838,"경상북도 청도군 청도군 각북면 농촌중심지 활성화사업(행복주민센터, 주민행복마당)",,,
2839,광주광역시 북구 무돌길(금곡마을) 공중화장실,,,
2840,경기도 화성시 서연중학교,경기 화성시 장지동 972,37.160892262095,127.110118249572
2841,대구광역시 달서구 월성수복정경로당,대구 달서구 월성동 273,35.8324469380722,128.530447885264
2842,경상북도 영양군 입암면분회(신구리) 경로당,경북 영양군 입암면 신구리 534-2,36.5929279685305,129.089319509903
2843,서울특별시 강남구 개포초등학교 및 유치원,,,
2844,서울특별시 은평구 은평구 어르신일자리 지원센터,서울 은평구 녹번동 11-3,37.6070539505574,126.933366669883
2845,제주특별자치도 제주시 제주 삼성혈 전시관,제주특별자치도 제주시 이도일동 1775-12,33.5006612437536,126.527755524668
2846,경상남도 양산시 양산 비즈니스센터 및 첨단하이브리드 생산기술 센터,,,
2847,경상남도 양산시 상북면 어울림마당 공중화장실,,,
2848,충청북도 제천시 제천시 치매가족쉼터,,,
2849,충청북도 괴산군 사리면 예비군중대본부,,,
2850,경상남도 통영시 통영시 화장시설,경남 통영시 정량동 52-3,34.8518903088955,128.439759334322
2851,경상남도 의령군 의령군 청소년문화의 집,경남 의령군 의령읍 서동리 560,35.3161689391637,128.252756485939
2852,대구광역시 수성구 삼덕동 경로당,대구 수성구 삼덕동 552-1,35.8279525107449,128.668741087374
2853,제주특별자치도 제주시 조천 주민교류센터,,,
2854,강원도 홍천군 노천 초등학교,강원 홍천군 동면 노천리 1441,37.6683918195464,128.014144116199
2855,경기도 남양주시 다산진건지구 공영주차장(타워식),,,
2856,전라남도 곡성군 곡성경찰서 오곡파출소,전남 곡성군 오곡면 오지리 909-1,35.2729118556404,127.313512275158
2857,인천광역시 연수구 송도컨벤시아 1단계,인천 연수구 송도동 6-1,37.3881766252214,126.646217378186
2858,경기도 광명시 광명7동 주민센터 신축공사,,,
2859,세종특별자치시  행정중심복합도시 3-11호 어린이공원,,,
2860,부산광역시 동구 부산희망드림 종합센터,,,
2861,부산광역시 강서구 부산지방기상청 청사,,,
2862,전라남도 화순군 무등산국립공원동부사무소,전남 화순군 화순읍 유천리 258-4,35.0663766621907,126.997873581134
2863,대구광역시 서구 비산4동 어린이집,대구 서구 비산동 223-4,35.87008046095,128.573596916316
2864,세종특별자치시  (가칭) 해밀유치원,,,
2865,부산광역시 기장군 정관 아쿠아 드림파크,부산 기장군 정관읍 모전리 676,35.3413648662752,129.164579375623
2866,강원도 강릉시 포남1동 주민센터,강원 강릉시 포남동 1295-2,37.7727061402257,128.91333804127
2867,경기도 김포시 김포향산 근린공원 관리사무소,,,
2868,충청남도 천안시 직산 삼은저수지 생활체육공원 내 화장실 및 게이트볼장,,,
2869,충청남도 태안군 소원면 공립형 지역아동센터,,,
2870,충청남도 논산시 성광온누리학교,충남 논산시 성동면 병촌리 351,36.1925169189701,127.012291420962
2871,경기도 화성시 통탄 아름드림센터,,,
2872,경기도 시흥시 시흥어울림국민체육센터,경기 시흥시 정왕동 1800-6,37.3482221187884,126.741285833621
2873,강원도 삼척시 도계 평생학습관,,,
2874,경상남도 창원시 석동 공영주차빌딩,경남 창원시 진해구 석동 140,35.1527378768856,128.70517920595
2875,제주특별자치도 제주시 판포리 게이트볼장,,,
2876,전라남도 영광군 미래 이동수단 사용자 경헙랩,,,
2877,제주특별자치도 서귀포시 신례1리 마을 복지회관,,,
2878,서울특별시 양천구 구립 목4동 어린이집,서울 양천구 목동 771-5,37.5347692022762,126.867463447286
2879,충청남도 천안시 천안북부스포츠센터(운동장),,,
2880,충청남도 천안시 천안북부스포츠센터,충남 천안시 서북구 성환읍 매주리 393-10,36.8996860917972,127.132194991592
2881,경기도 수원시 서호꽃뫼공원-The 큰 통합놀이터,,,
2882,경기도 평택시 현덕축구장,경기 평택시 현덕면 덕목리 521-3,36.953511535448,126.95749324075
2883,충청북도 음성군 음성군 평생학습관,,,
2884,강원도 양양군 송이연어푸드 디자인센터,,,
2885,경기도 안산시 아이러브맘카페 2호점 건립공사,,,
2886,전라북도 김제시 청년창업공간『아토(芽土)』,,,
2887,경상북도 울진군 흥부 하나어린이집,,,
2888,경기도 안양시 석수1동 경로당,경기 안양시 만안구 안양동 707-139,37.3937289132072,126.921481404823
2889,서울특별시 양천구 목동 센트럴 아이파크위브(4단지),,,
2890,서울특별시 양천구 목동 센트럴 아이파크위브(3단지),,,
2891,서울특별시 양천구 목동 센트럴 아이파크위브(2단지),,,
2892,서울특별시 양천구 목동 센트럴 아이파크위브(1단지),,,
2893,전라남도 진도군 국민해양안전관 건립사업(유스호스텔),,,
2894,전라남도 진도군 국민해양안전관 건립사업(국민해양안전관),,,
2895,충청북도 충주시 충주시 유소년 축구장,,,
2896,제주특별자치도 서귀포시 발자국 화석산지 수장고,,,
2897,경기도 시흥시 배곧 한울초등학교,경기 시흥시 정왕동 2572,37.3601243508604,126.712651023728
2898,인천광역시 서구 인천 서부소방서 오류119안전센터,인천 서구 오류동 1735-3,37.5945183276458,126.632548722556
2899,전라남도 화순군 화순군 치매안심센터 및 기초정신건강복지센터,,,
2900,강원도 동해시 청운경로당,,,
2901,강원도 동해시 해오름 경로당,강원 동해시 구미동 589-6,37.4785156365229,129.128235283845
2902,제주특별자치도 제주시 제주시 한림읍 청사 신축공사,,,
2903,경기도 김포시 운양환승센터 조성사업(B동),,,
2904,경기도 김포시 운양환승센터 조성사업(A동),,,
2905,서울특별시 양천구 용왕산 화장실 및 관리실,,,
2906,충청북도 단양군 단성면 상방리 다목적회관,,,
2907,"경상남도 김해시 부원 2,3,4통 경로당",,,
2908,경상북도 구미시 구미시 공설 숭조당 2관,,,
2909,경상북도 성주군 성주군 어린이놀이터(공중화장실),,,
2910,경기도 포천시 포천시 치매안심센터 일동쉼터,경기 포천시 일동면 기산리 88-31,37.9558117718689,127.315381147042
2911,충청북도 청주시 청주시 새활용시민센터,충북 청주시 청원구 주성동 297-19,36.682514929848,127.499152338607
2912,인천광역시 서구 청라3동 행정복지센터,인천 서구 청라동 155-14,37.5325710363019,126.644209105144
2913,경기도 구리시 시립인창어린이집,경기 구리시 인창동 626,37.6066617253159,127.128962971854
2914,경기도 연천군 동두천~연천 복선전철 연천역사,,,
2915,경기도 연천군 동두천~연천 복선전철 초성리역사,,,
2916,경기도 연천군 동두천~연천 복선전철 전곡역사,,,
2917,경상북도 경주시 영천-신경주 복선전철 아화역사,,,
2918,울산광역시 울주군 삼남면가천경로당,울산 울주군 삼남읍 가천리 385-2,35.5316505227843,129.090370340502
2919,경기도 평택시 새한어린이공원 공중화장실,,,
2920,강원도 인제군 인제군 방동리 경로당,강원 인제군 기린면 방동리,37.9251279406181,128.407590459342
2921,전라북도 부안군 새만금 환경생태용지 방문자센터,,,
2922,경상남도 진주시 경남진주혁신도시 복합혁신센터,,,
2923,전라남도 고흥군 남양면 다목적 복지회관,,,
2924,전라북도 고창군 고창군 장애인주간보호 직업재활시설,,,
2925,서울특별시 강남구 개원 지구대,,,
2926,서울특별시 강남구 개포동 우체국,서울 강남구 개포동 14-4,37.493652897878,127.078059604909
2927,서울특별시 강남구 개포 어린이집,서울 강남구 개포동 1164-16,37.4735686634604,127.053528506045
2928,경기도 안양시 호원지구 소공원 지하 공영주차장 조성사업,,,
2929,전라남도 광양시 광양시 기능훈련센터 신축공사,,,
2930,전라북도 고창군 국민건강보험공단 고창출장소 사옥신축공사,,,
2931,대구광역시 달서구 달서영어도서관,대구 달서구 송현동 2003-32,35.8311897332958,128.555216068468
2932,경기도 양주시 (가칭)옥정10초등학교,,,
2933,경기도 안양시 비산1동 행정복지센터,경기 안양시 동안구 비산동 488-15,37.3998591534192,126.933620011911
2934,제주특별자치도 서귀포시 서귀포시 신효경로당,제주특별자치도 서귀포시 신효동 700-2,33.2645684723608,126.614235729975
2935,경상남도 양산시 이팝문화센터,,,
2936,강원도 강릉시 강동파출소,강원 강릉시 강동면 상시동리 150-1,37.7265612720027,128.954682528132
2937,경상남도 남해군 남해군 가인포보건진료소,,,
2938,경상남도 창원시 월영 주거환경개선사업 경로당,,,
2939,경기도 성남시 성남소방서,경기 성남시 수정구 수진동 4417,37.4366313175296,127.133451318963
2940,강원도 홍천군 남면 신대1리 마을회관 및 경로당,,,
2941,강원도 홍천군 자은리 친환경 공중화장실,,,
2942,경기도 화성시 (가칭)동탄10초등학교,,,
2943,경상북도 성주군 초전어린이집,경북 성주군 초전면 대장리 592,35.9761660247155,128.262330495426
2944,대구광역시 달성군 심인고등학교,대구 달성군 다사읍 죽곡리 816,35.8528377802508,128.465333703598
2945,대구광역시 달성군 심인중학교,대구 달성군 다사읍 죽곡리 819,35.8529168170735,128.466655168825
2946,전라북도 고창군 바람숲 화장실,,,
2947,충청남도 아산시 충청남도교육청 과학교육원,충남 아산시 장존동 185-9,36.7487204553258,126.991393079855
2948,충청북도 옥천군 옥천군 군서면 은행보건진료소,충북 옥천군 군서면 은행리 143-2,36.2699969972994,127.509335607306
2949,경상남도 진주시 경상남도교육청 학생안전체험교육원,경남 진주시 문산읍 삼곡리 640-1,35.1664955522415,128.166739227551
2950,경기도 김포시 걸포3지구 중앙공원 관리사무소,,,
2951,제주특별자치도 제주시 신양1리 마을회관,,,
2952,경상남도 창원시 병암동 다목적주민자치사랑방,,,
2953,강원도 양양군 양양전통시장 주차장,강원 양양군 양양읍 남문리,38.0735587080703,128.625044559538
2954,경기도 남양주시 경기시청자미디어센터,경기 남양주시 다산동 3209-2,37.6125827020318,127.168090295255
2955,서울특별시 성북구 장위5구역 내 노유자시설,,,
2956,경상북도  청송읍 분회경로당,경북 청송군 청송읍 월막리 198-2,36.4336270886303,129.057722926052
2957,경상남도 김해시 전하3통 경로당,경남 김해시 전하동 17-1,35.2246873380147,128.873325838631
2958,전라남도 무안군 무안 각설이 품바 전승관,,,
2959,충청북도 충주시 칠금동 주차전용건축물,,,
2960,전라북도 순창군 복흥면 청소년문화의 집 및 노인교실,,,
2961,강원도 화천군 토마토수영장,강원 화천군 사내면 사창리 459-8,38.0711654657592,127.519723878604
2962,서울특별시 송파구 가락1동 주민센터 및 가락1동 어린이집,,,
2963,대전광역시 서구 노루벌 구절초와 반디의 숲 체험원,,,
2964,부산광역시 사상구 부산도시철도 사상~하단선 503 정거장,,,
2965,부산광역시 사상구 부산도시철도 사상~하단선 스마트시티 정거장,,,
2966,제주특별자치도 서귀포시 서귀포 시각장애인 주간보호시설,제주특별자치도 서귀포시 월평동 476-1,33.2441620101483,126.459381734831
2967,인천광역시 미추홀구 주안동 장애인거주시설,인천 미추홀구 도화동 95-30,37.4679860319019,126.662405489367
2968,충청남도 예산군 신례원 버스승강장 공중화장실,,,
2969,경기도 동두천시 소요 별&숲 테마파크,경기 동두천시 상봉암동 15,37.9495720956409,127.065370480918
2970,경상북도 성주군 성밖숲정보센터,,,
2971,충청남도 논산시 논산시사람꽃복지관(구 논산시장애인종합복지관),,,
2972,전라북도 군산시 국립신시도자연휴양림 조성사업,,,
2973,경상북도 칠곡군 (가칭)남율중학교 신축공사,,,
2974,울산광역시 동구 동울산종합시장 공영주차장 및 고객지원센터,,,
2975,서울특별시 중구 서울시 시네마테크 건립,,,
2976,서울특별시 도봉구 창동 창업 및 문화 산업단지 조성사업,,,
2977,경기도 김포시 김포시 풍무도서관,경기 김포시 풍무동 156-5,37.6069566975839,126.727443436515
2978,전라남도 보성군 보성군 노동면사무소,전남 보성군 노동면 광곡리 254,34.7989223870492,127.067937239161
2979,경상남도 의령군 의령 농가형 전통장류 활성화센터,,,
2980,경상북도 안동시 안동시 북후면 농촌중심지활성화 공중화장실,,,
2981,대전광역시 유성구 봉산어린이공원 공중화장실,대전 유성구 봉산동 216,36.4358614999624,127.38787672697
2982,전라남도 순천시 환선정 창작공원 관광명소화사업,,,
2983,경기도 화성시 시립향남공원 어린이집,경기 화성시 향남읍 상신리 1308,37.1012618718264,126.897416355088
2984,전라남도 진도군 진도읍 환경미화원 복지센터,,,
2985,경기도 광명시 하안1동 밤일마을 경로당 건립공사,,,
2986,강원도 홍천군 서면 생활체육공원 다목적 체육시설,,,
2987,경상남도 창원시 진해경찰서 자은파출소,경남 창원시 진해구 자은동 146,35.1540602611074,128.713193481316
2988,경상남도 김해시 선지공원 공중화장실,,,
2989,경상남도 김해시 선천들공원 공중화장실,,,
2990,경상남도 김해시 무지개공원 공중화장실 2,,,
2991,경상남도 김해시 무지개공원 공중화장실 1,,,
2992,전라남도 여수시 학동 공중화장실,전남 여수시 학동 201,34.7561231216912,127.658624866169
2993,전라남도 여수시 꽃가람공원 편익시설(공중화장실),,,
2994,전라남도 여수시 백야항 화장실,,,
2995,전라북도 군산시 익산~대야 복선전철 대야역사,,,
2996,대전광역시 서구 월평도서관,대전 서구 갈마동 820,36.356020244175,127.372682090023
2997,강원도 원주시 강원혁신지식산업센터,강원 원주시 반곡동 1913-12,37.3249559459741,127.98902657889
2998,강원도 동해시 동해시종합버스터미널,강원 동해시 평릉동 166-4,37.5277350694699,129.103954371451
2999,제주특별자치도 서귀포시 중문보건지소 이전 신축공사,,,
3000,경상남도 양산시 덕계2초등학교,경남 양산시 덕계동 1588,35.3739082896507,129.160428331343
3001,경상북도 문경시 문경시 청정식물원 내 체험 및 판매장,,,
3002,충청북도 충주시 충주 연수동 주차전용건축물(2),,,
3003,충청북도 충주시 충주 연수동 주차전용건축물(1),,,
3004,인천광역시 연수구 학나래 근린공원 화장실,,,
3005,경상남도 하동군 하동 학숙 배움터 조성사업,,,
3006,서울특별시 동작구 신대방1동 구립 지역아동센터,,,
3007,대구광역시 달서구 달서구 장애인복지센터,대구 달서구 도원동 1468,35.802437659005,128.535983751036
3008,경상북도 경주시 경주 황성공원 내 물놀이장(공중화장실),,,
3009,충청남도 논산시 논산시 치매안심센터,충남 논산시 관촉동 327-2,36.1955211713431,127.102506972123
3010,세종특별자치시  반곡유초등학교,,,
3011,경상남도 창원시 교방여성경로당,경남 창원시 마산합포구 교방동 286-12,35.2136718823995,128.567042826815
3012,충청남도 논산시 논산시 공영주차장 주차타워,,,
3013,충청남도 아산시 아산시 청소년문화의집,충남 아산시 배방읍 장재리 1351,36.7885165220042,127.094472745215
3014,충청북도 청주시 충청북도 재난안전체험교육관,,,
3015,전라북도 정읍시 태인축구장 관리사무동,,,
3016,전라북도 익산시 익산시 미륵사지 관광지 공중화장실,,,
3017,전라북도 익산시 익산시 미륵사지 관광지 전통문화 전시관,,,
3018,충청남도 논산시 화지중앙시장 화장실,충남 논산시 화지동 71-5,36.206533200997,127.084442875218
3019,제주특별자치도 서귀포시 제주 국립산림생태관리센터(지원동),,,
3020,제주특별자치도 서귀포시 제주 국립산림생태관리센터(사무동),,,
3021,광주광역시 광산구 하남3지구 주차전용건축물 1,,,
3022,경기도 군포시 고랑치기 주차장,경기 군포시 부곡동 1246-1,37.3266517759212,126.941784592992
3023,전라남도 함평군 함평중학교,전남 함평군 함평읍 기각리 1175,35.0681729015052,126.522298274699
3024,전라남도 신안군 가거도 해양보호구역 해양센터 및 관리사무소,,,
3025,경기도 고양시 (가칭)지축중학교,,,
3026,광주광역시 서구 광주 노인회관,광주 서구 치평동 1154,35.1524786875749,126.838024957529
3027,인천광역시 연수구 (가칭)동춘1초등학교 신축공사,,,
3028,서울특별시 강서구 강서구 청소년상담복지센터,서울 강서구 화곡동 1071-26,37.5394557575666,126.835514184028
3029,광주광역시 서구 서구치매안심센터,광주 서구 쌍촌동 1004-13,35.1488362666606,126.860306325025
3030,경기도 시흥시 (가칭)장현2중학교,,,
3031,충청남도 보령시 충남 보령경찰서 이전 신축공사,,,
3032,제주특별자치도 서귀포시 하원 마을회관,제주특별자치도 서귀포시 하원동 480-4,33.2567262858365,126.461054249361
3033,부산광역시 서구 서대신5구역 치안센터,,,
3034,인천광역시 부평구 부평4동 행정복지센터 신축공사,,,
3035,광주광역시 동구 무등산국립공원 사무소,광주 동구 운림동 438,35.1316651788637,126.947990549256
3036,대구광역시 중구 신천 커뮤니티센터,,,
3037,서울특별시 동작구 흑석8구역 롯데캐슬 에듀포레,,,
3038,경상북도 청도군 옥산보건진료소,경북 청도군 각남면 녹명리 326-1,35.6289380514086,128.637522560412
3039,충청남도 공주시 공주시 보건소 치매안심센터,,,
3040,경상남도 산청군 천상화원 탐방지원센터,,,
3041,전라남도 완도군 노화 갈꽃섬 전복오감여행학교,,,
3042,경상북도 성주군 성주군 월항주차공원 공중화장실,,,
3043,강원도 홍천군 용수리(큰말)경로당,강원 홍천군 남면 용수리 238-6,37.6596386939549,127.750141757479
3044,대구광역시 수성구 범어2동 커뮤니티센터,대구 수성구 만촌동 990-28,35.8648578783039,128.647389988742
3045,경기도 화성시 동탄8동 행정복지센터,경기 화성시 방교동 828,37.1733508234942,127.089569433181
3046,경상북도 청도군 청도군 치매안심센터 및 정신건강복지센터,,,
3047,제주특별자치도 제주시 상가리 마을회 경로당 증축 공사,,,
3048,경기도 하남시 하남 위례도서관,경기 하남시 학암동 90-46,37.4825241977798,127.148669572486
3049,전라북도 익산시 익산시 보훈회관,전북 익산시 신동 760-8,35.9646375229945,126.953905000131
3050,충청남도 홍성군 충남도서관,충남 홍성군 홍북읍 신경리 887,36.6570255479898,126.669316329339
3051,서울특별시 성북구 서울시 창작연극 지원센터,,,
3052,경기도 양주시 (가칭)옥정5중학교,,,
3053,경기도 수원시 수원팔달구·장안구 선거관리위원회 합동청사,,,
3054,경상북도 구미시 항곡1리 경로당,,,
3055,경기도 여주시 이포권역 다목적 행복센터,,,
3056,제주특별자치도 제주시 추자면 묵리 노유자시설(경로당)신축공사,,,
3057,경기도 시흥시 목감도서관,경기 시흥시 목감동 398,37.3855650149302,126.86133144245
3058,경기도 시흥시 목감도서관,경기 시흥시 물왕동 398,37.383130520592,126.823515799909
3059,경기도 시흥시 목감도서관,경기 시흥시 산현동 398,37.3628209062552,126.832004109847
3060,경기도 화성시 화성 동탄2 제16초 이음터,,,
3061,대구광역시 서구 내당1동 행정복지센터,대구 서구 내당동 12-36,35.8634324463259,128.563970900106
3062,경상남도 진주시 (가칭)비봉 커뮤니티 센터 (비봉새뜰),,,
3063,"세종특별자치시  버스, 에디슨모터스 화이버드 초저상",,,
3064,"세종특별자치시  버스, 현대 뉴슈퍼에어로시티 초저상버스",,,
3065,"세종특별자치시  버스, 현대 블루시티 초저상 하이브리드",,,
3066,서울특별시 성북구 성북구립 삼선실버복지센터,,,
3067,강원도 평창군 평창군 어울림 문화센터,,,
3068,부산광역시 북구 정이있는 구포시장 고객편의시설,,,
3069,충청남도 보령시 도화담2리 생활체육시설,,,
3070,경기도 의정부시 호원1동 경로당,경기 의정부시 호원동 121,37.7060709804331,127.050047022331
3071,경상북도 영양군 석보면분회경로당,경북 영양군 입암면 신구리 534-2,36.5929279685305,129.089319509903
3072,전라북도 고창군 동호해수욕장 공중화장실,전북 고창군 해리면 동호리 627,35.5161308558679,126.48270758514
3073,강원도 화천군 화천소방서,강원 화천군 하남면 위라리 380-1,38.0981270976963,127.71381198014
3074,경상남도 고성군 고성해양레포츠 아카데미,,,
3075,전라북도 정읍시 정읍우체국,전북 정읍시 수성동 558-2,35.5671960344055,126.852133611736
3076,전라남도 여수시 전남여수산학융합지구,,,
3077,인천광역시 서구 검단노인복지관,인천 서구 마전동 987-7,37.6021265664848,126.661261898697
3078,인천광역시 중구 (가칭)하늘3중학교,,,
3079,충청남도 천안시 목천읍 주민자치센터,충남 천안시 동남구 목천읍 서리 100-16,36.783580568789,127.234975194843
3080,인천광역시 남동구 신월경로당,인천 남동구 구월동 1283-18,37.4496779569682,126.720130939879
3081,경상북도 고령군 고령군 아이나라 키즈교육센터,,,
3082,충청북도 옥천군 금구 공영주차타워,,,
3083,서울특별시 마포구 망원동 공영주차장,서울 마포구 망원동 403-2,37.5555820062404,126.905860657206
3084,경상남도 창원시 경남마산로봇랜드 컨벤션센터,,,
