index,title,address,lat,lon
856,충청남도 천안시 입장면 산정1리 경로당,충남 천안시 서북구 입장면 산정리 264-1,36.9402277781479,127.179189830936
857,강원도 평창군 평창돌문화체험관,강원 평창군 평창읍 중리 15-3,37.3763377911964,128.409604790501
858,서울특별시 송파구 풍납2동 복합청사,,,
859,충청남도 아산시 2020년 은행나무길 화장실(느티광장) 신축공사,,,
860,대전광역시 대덕구 새여울 커뮤니티센터,,,
861,경기도 시흥시 시화MTV 86호 수변공원 화장실,,,
862,경기도 시흥시 시화MTV 85호 수변공원 화장실,,,
863,부산광역시 사하구 신평장림 산업단지 혁신지원센터,,,
864,인천광역시 강화군 석모도 만남의 광장(공중화장실),,,
865,경상남도 고성군 이당일반산업단지 내 지원시설(식당),,,
866,대구광역시 서구 대구 서구 복합커뮤니티시설,,,
867,강원도 철원군 철원군장병쉼터,,,
868,경기도 안성시 안성시 정신건강복지센터,경기 안성시 도기동 67-21,37.0001829555766,127.269965301816
869,인천광역시 서구 마전 다목적체육관 신축공사,,,
870,경기도 수원시 매탄2동 공영주차장,경기 수원시 영통구 매탄동 1268,37.259205962215,127.046596602761
871,서울특별시 강남구 강북장애인복지관,,,
872,경상북도 고령군 고아리벽화고분 모형관,,,
873,전라북도 익산시 익산경찰서 성당파출소,전북 익산시 성당면 장선리 275-2,36.0870548327603,126.937796797071
874,전라남도 완도군 완도군 청년센터,,,
875,서울특별시 동대문구 힐스테이트 청량리역,서울 동대문구 청량리동 235-6,37.5830648923496,127.048267354529
876,경기도 수원시 수인분당선 오목천역,경기 수원시 권선구 오목천동,37.2418690484095,126.969394427065
877,경상남도 하동군 갑정보건진료소,경남 하동군 진교면 월운리 681,35.0684431990521,127.883790660136
878,경기도 수원시 수인분당선 고색역,경기 수원시 권선구 고색동,37.246196958883,126.984144062997
879,충청남도 홍성군 홍성 어사노을공원 화장실,,,
880,강원도 홍천군 화상대2리 어은동 마을회관 및 경로당,,,
881,인천광역시 강화군 어유정항 화장실 신축공사,,,
882,전라남도 강진군 강진만 생태탐방 학습홍보관,,,
883,경기도 안성시 아양도서관,경기 안성시 옥산동 564,37.0055831570191,127.254450286714
884,충청북도 괴산군 괴산 서울농장,,,
885,전라북도 익산시 익산 공공승마장 및 재활승마 인프라 조성공사,,,
886,전라북도 전주시 전주 덕진구 혁신동 주민센터 건립공사,,,
887,경기도 구리시 구리시 갈매동 복합청사,,,
888,충청남도 서천군 송석항 해의커뮤니티센터,,,
889,경기도 화성시 (가칭)봉담1유치원,,,
890,경상북도 영천시 (가칭)웰컴센터,,,
891,충청북도 제천시 제천시 생활밀착형 국민체육센터 건립사업,,,
892,경상북도 영천시 (가칭)어울림플랫폼,,,
893,경상북도 경주시 경주국립공원 건천분소,경북 경주시 건천읍 천포리 402-1,35.8535567410523,129.100743372143
894,인천광역시 남동구 간석4동 행정복지센터,인천 남동구 간석동 49-1,37.4661276816333,126.714589199352
895,경기도 광주시 광남동 행정복합문화시설,,,
896,경기도 수원시 팔달구 문화센터,경기 수원시 팔달구 인계동 1117,37.2630951136906,127.03779996473
897,인천광역시 강화군 삼산면 주민자치타운 청사,,,
898,인천광역시 서구 (가칭)검단5초등학교,,,
899,경기도 광주시 오포 어린이 체육시설,경기 광주시 오포읍 신현리 46,37.3740162169215,127.177387608988
900,제주특별자치도 제주시 추자파출소,제주특별자치도 제주시 추자면 대서리 19,33.9639376686348,126.295962794609
901,강원도 동해시 동호지구 도시재생사업 파란발전소,,,
902,충청남도 예산군 충남 스포츠센터 건립공사 통합운영센터 및 수영장,,,
903,충청남도 예산군 충남 스포츠센터 건립공사 다목적체육관,,,
904,경기도 화성시 화성 독립운동 기념관 건립공사,,,
905,충청북도 충주시 유네스코 국제무예센터,충북 충주시 금릉동 577,36.9919078081493,127.908764232052
906,충청북도 충주시 유네스코 국제무예센터,충북 충주시 칠금.금릉동 577,36.9870218541899,127.921584801869
907,충청북도 청주시 생명초중학교,충북 청주시 청원구 오창읍 양청리 810-9,36.7118451061543,127.438682860439
908,경기도 화성시 다원유치원,경기 화성시 영천동 539-8,37.2103653785589,127.103782459624
909,강원도 원주시 서부권 건강생활지원센터,,,
910,경상남도 김해시 전하3통 경로당,경남 김해시 전하동 17-1,35.2246873380147,128.873325838631
911,전라남도 해남군 보성~임성리 철도건설 해남역사,,,
912,전라남도 장흥군 보성~임성리 철도건설 장흥역사,,,
913,전라남도 장흥군 보성~임성리 철도건설 장동역사,,,
914,전라남도 영암군 보성~임성리 철도건설 영암역사,,,
915,전라남도 강진군 보성~임성리 철도건설 강진역사,,,
916,전라남도 보성군 보성~임성리 철도건설 보성역사,,,
917,충청남도 금산군 금산교육지원청 교육지원센터,,,
918,대전광역시 유성구 솔마루 어린이공원 공중화장실,,,
919,충청북도 청주시 용아초등학교,충북 청주시 상당구 용암동 236-6,36.6183582070741,127.52254790605
920,충청북도 청주시 동남유치원,충북 청주시 상당구 용암동 122-6,36.617173919022,127.522717652924
921,서울특별시 동작구 청석 거주자우선주차장 복합화사업,,,
922,서울특별시 용산구 응봉근린공원 관리사무소,,,
923,경기도 이천시 국공립장호원 어린이집 신축공사,,,
924,강원도 양양군 양양전통시장 공영주차장,강원 양양군 양양읍 남문리 3-23,38.0752611673497,128.625039504441
925,울산광역시 울주군 천전경로당,울산 울주군 두동면 천전리 1210-34,35.6172630022772,129.1528494999
926,충청남도 부여군 부여읍 북부보건진료소,충남 부여군 부여읍 자왕리 377-3,36.309644587398,126.955840170152
927,서울특별시 구로구 구로구 항동복합행정센터 신축공사,,,
928,경기도 수원시 THE 큰 통합놀이터,,,
929,경상북도 문경시 고요아리랑 민속마을,,,
930,울산광역시 울주군 두동곽성경로당,,,
931,울산광역시 울주군 범서곡연경로당,,,
932,울산광역시 울주군 서부2리 경로당,,,
933,대전광역시 동구 성남동 다목적체육관,대전 동구 성남동 537,36.3426229588461,127.430789808942
934,경기도 수원시 화서시장 공영주차장,경기 수원시 팔달구 고등동 57-1,37.2732511568223,127.005628458374
935,서울특별시 영등포구 국회 의원회관,서울 영등포구 여의도동 1,37.5310586079353,126.915381487445
936,경기도 남양주시 다산꽃다비유치원,경기 남양주시 다산동 6120,37.6191950201671,127.162841646523
937,경상남도 하동군 옥종 행복나눔센터,,,
938,충청남도 공주시 공산성 방문자 센터,충남 공주시 금성동 65-2,36.4649026976725,127.123697867001
939,서울특별시 동작구 구립 한울 어린이집,서울 동작구 신대방동 344-281,37.4943278013813,126.926367946286
940,강원도 강릉시 소금강분소,강원 강릉시 연곡면 삼산리 46-3,37.8136577332823,128.704600273072
941,경상남도 하동군 하동 나누리플랫폼,,,
942,경상남도 통영시 정량천 생태하천 공중화장실,,,
943,울산광역시 울주군 상평2리 경로당,,,
944,경상북도 영천시 언하2동 경로당,,,
945,경상북도 영천시 영천시 자양보건지소,경북 영천시 자양면 성곡리 552-1,36.078479010875,129.0183788832
946,세종특별자치시  정부세종청사 직장어린이집(1-38),,,
947,전라북도 군산시 대야시장 인근 편의시설,,,
948,경상북도 경주시 경주시 건천읍 행정복합타운,,,
949,경상남도 밀양시 밀양시농업기술센터 교육관,,,
950,대전광역시 대덕구 신탄진 도시재생 육아종합지원센터,,,
951,경상북도 문경시 영순면 분회경로당,,,
952,강원도 고성군 행복고성문화복합센터,,,
953,경기도 군포시 산본로데오거리 주차전용건축물,,,
954,전라북도 정읍시 신태인읍 행정문화복합센터,,,
955,충청남도 공주시 치유센터 조성사업,,,
956,충청남도 금산군 남부체육센터 클럽하우스,,,
957,전라북도 고창군 아산면 농촌중심지활성화사업(아산희망센터),,,
958,경기도 화성시 무봉산 자연휴양림,,,
959,충청남도 계룡시 계룡시 종합사회복지관,충남 계룡시 엄사면 유동리 288,36.2730978036001,127.233011069549
960,경상북도 경주시 양동마을 경로당,,,
961,서울특별시 서초구 방배숲도서관,서울 동작구 사당동 256-1,37.484510568898,126.973480871927
962,전라남도 여수시 꽃가람공원 공중화장실,,,
963,경기도 부천시 (가칭)계수중학교 신축공사,,,
964,서울특별시 송파구 송파 구립 거여하나어린이집,,,
965,경상북도 포항시 경상북도 동부청사 건립공사,,,
966,경상북도 김천시 경상북도김천교육지원청 학생문화예술센터,,,
967,경기도 광명시 개운어린이공원 지하주차장,,,
968,제주특별자치도 제주시 신산머루 돌봄센터 신축공사,,,
969,광주광역시 동구 남광주시장 공중화장실,광주 동구 학동 55,35.1391467321841,126.921765322838
970,부산광역시 사상구 부전~마산 복선전철 사상역,,,
971,경상남도 거창군 거창 하천환경교육센터,경남 거창군 거창읍 가지리 188-1,35.6953903515634,127.910506897784
972,울산광역시 북구 강동고등학교,울산 북구 산하동 산 61-11,35.6323716770437,129.435479713144
973,제주특별자치도 서귀포시 서귀포 추모공원 공설봉안당(별관),,,
974,경상남도 양산시 가촌2초등학교 교사 신축공사,,,
975,경기도 화성시 봉담2 주2 공영주차장,,,
976,경기도 화성시 봉담2 주1 공영주차장,,,
977,경기도 고양시 고양도서관,경기 고양시 일산동구 마두동 804,37.65110369472,126.779315913698
978,경상북도 영천시 동부4통 경로당,경북 영천시 야사동 183-5,35.9746263142344,128.945588448661
979,경기도 용인시 수지구 동천동 노인정 신축공사,,,
980,충청남도 서산시 해미시장 시설현대화사업 관광형 테마시장,,,
981,부산광역시 강서구 강서구 육아종합지원센터,부산 강서구 명지동 3390-1,35.1008688892318,128.925472338642
982,경기도 성남시 위례 어울림 종합사회복지관,,,
983,전라북도 전주시 전주덕진지구대,전북 전주시 덕진구 덕진동2가 179-6,35.8481957547168,127.120490468797
984,제주특별자치도 제주시 삼양동 선사유적지 주차장 관리사무소,,,
985,충청북도 음성군 금왕 산업단지 개방형체육관 건립사업,,,
986,전라남도 순천시 호남 호국기념관,전남 순천시 연향동 144,34.9358861587437,127.521262343903
987,광주광역시 북구 스테이션G 건립사업,,,
988,강원도 홍천군 북방면 중화계리 경로당,강원 홍천군 북방면 중화계리 147-2,37.70299673601,127.867168626707
989,대구광역시 중구 중구 재활용센터,대구 중구 봉산동 206-24,35.8608316167383,128.599381693634
990,경기도 남양주시 남양주경찰서 퇴계원파출소,,,
991,경기도 수원시 수원시 제16호 문화공원 내 화장실,,,
992,인천광역시 중구 인천중산중학교,인천 중구 중산동 1914-2,37.4981455807373,126.571275210066
993,경기도 화성시 화남초등학교,경기 화성시 장지동 915,37.1637077415797,127.096095394636
994,제주특별자치도 제주시 제주산학융합지구,,,
995,충청남도 서산시 지곡면 청사 건립사업,,,
996,충청북도 충주시 (가칭) 용전고등학교 신축공사,,,
997,충청북도 제천시 제천예술의전당 건립사업 건축공사,,,
998,서울특별시 성동구 성동 맘앤키즈 복합문화센터,,,
999,경기도 시흥시 (가칭)은계1유치원 신축공사,,,
1000,경기도 성남시 고등동행정복지센터,경기 성남시 수정구 고등동 378-1,37.428844315269,127.10481588128
1001,부산광역시 수영구 광안노인복지관 및 수영구 장애인복지관,,,
1002,경기도 화성시 동탄2 제28초 이음터,,,
1003,경기도 화성시 동탄2 제1초 이음터,,,
1004,경상북도 안동시 안동역사,경북 안동시 풍천면 가곡리 595,36.5723467833457,128.522297113657
1005,세종특별자치시  보람종합복지센터,세종특별자치시 보람동 767,36.4792573523367,127.292315003798
1006,서울특별시 금천구 남부도로사업소 청사,,,
1007,제주특별자치도 제주시 김녕항 수산문화복합센터,,,
1008,인천광역시 부평구 백운경로당,인천 부평구 십정동 186-408,37.4832362941661,126.703870340998
1009,서울특별시 노원구 상계5동청사,서울 노원구 상계동 1120-63,37.6747732547015,127.057636377008
1010,경기도 오산시 오산천 공영주차장,,,
1011,충청남도 아산시 온양5동 행정복지센터,충남 아산시 용화동 677,36.7752381880863,126.996062974593
1012,경상남도 양산시 대운산 생태숲 체험관,,,
1013,충청남도 서천군 장항의 집,충남 서천군 장항읍 신창리 150-29,36.0117570210773,126.69414557315
1014,경상남도 거제시 남해 국공립 하나 어린이집,,,
1015,제주특별자치도 제주시 제주시 이도2동 429-7 공영주차장 복층화사업,,,
1016,울산광역시 남구 철새홍보관,울산 남구 무거동 1225,35.5495396064649,129.279450801237
1017,전라남도 완도군 구계등 탐방안내소,,,
1018,충청남도 홍성군 홍성군 가족센터 건립공사,,,
1019,경기도 수원시 경기도 신청사,경기 수원시 영통구 이의동 184,37.2886911874676,127.054161407756
1020,경기도 광주시 감일2초등학교 신축공사,,,
1021,광주광역시 광산구 광산동 오룡마을 경로당,,,
1022,광주광역시 서구 광주 서구 유덕 하나어린이집,,,
1023,경상남도 김해시 김해서중학교 교사 신축 설계용역,,,
1024,부산광역시 북구 북구소방서,부산 북구 금곡동 54-2,35.2672857681149,129.017656630191
1025,강원도 영월군 동.서강 정원(화장실),,,
1026,전라남도 구례군 효곡보건진료소,전남 구례군 간전면 효곡리 366-6,35.1391102442611,127.541131443831
1027,전라남도 무안군 무안군해상안전체험관,전남 무안군 해제면 유월리 2-1,35.1024260351467,126.333455563176
1028,강원도 영월군 영흥14리 경로당,,,
1029,경기도 안양시 해당화 경로당,,,
1030,전라남도 여수시 오동도입구 관리동 및 공중화장실,,,
1031,경기도 하남시 하남우체국,경기 하남시 덕풍동 378-2,37.5400747423181,127.200728319028
1032,경기도 용인시 용인창의과학도서관,,,
1033,서울특별시 중구 서울애니메이션센터,서울 중구 회현동2가 10-1,37.5598162415723,126.983026626816
1034,경기도 가평군 탄벌쌈지공원 공중화장실,,,
1035,서울특별시 영등포구 e편한세상 영등포 아델포레,서울 영등포구 대림동 1127,37.4943934373007,126.90677940214
1036,충청북도 음성군 혁신도시 국민체육센터,충북 음성군 맹동면 동성리 486,36.9104022779944,127.541679221525
1037,충청남도 보령시 보령시 대천동 소매점 신축공사,,,
1038,경상북도 문경시 농암면 농촌중심지 활성화사업(농암면 행정복지센터),,,
1039,경상북도 문경시 문경 로컬푸드 문화센터,,,
1040,경기도 의정부시 도봉산~옥정 광역철도 1공구(102정거장),,,
1041,경상남도 창원시 양덕2동 탑골경로당,,,
1042,충청북도 단양군 북벽지구 테마공원 조성사업(북벽센터),,,
1043,경기도 고양시 일산도서관,경기 고양시 일산서구 일산동 954-6,37.6850066325223,126.76441701869
1044,경기도 파주시 파주 무대공연종합아트센터,경기 파주시 탄현면 법흥리 1631-9,37.7849855243113,126.696053702733
1045,서울특별시 강남구 달터근린공원 공원관리소,,,
1046,경기도 광주시 만선 문화복지센터,,,
1047,울산광역시 남구 3D프린팅품질평가센터,,,
1048,충청북도 괴산군 부흥보건지소,충북 괴산군 청안면 부흥리 204-3,36.7046967755041,127.730353664481
1049,인천광역시 서구 인천해원초등학교 별동 신축공사,,,
1050,경기도 시흥시 배곧도서관,경기 시흥시 정왕동 2491,37.3734941456666,126.733769851481
1051,경상남도 밀양시 밀양 스포츠파크,경남 밀양시 단장면 미촌리 940-51,35.5061463216469,128.83817220628
1052,전라북도 익산시 반다비(장애인)체육센터·펜싱아카데미,,,
1053,서울특별시 송파구 위례파출소,경기 성남시 수정구 창곡동 513-4,37.4723104184979,127.149695484494
1054,경기도 양주시 도봉산~옥정 광역철도 3공구 104정거장,,,
1055,경상남도 김해시 활천동 체육관,경남 김해시 어방동 685,35.2421442657328,128.900222858627
1056,울산광역시 울주군 온산읍 종합 행정복지타운,,,
1057,강원도 춘천시 춘천 중도 레고랜드 주차장 조성사업,,,
1058,경기도 화성시 반월 체육센터,경기 화성시 반월동 209,37.2303523078301,127.053491768189
1059,경상남도 함안군 함안 역사문화체험파크,경남 함안군 가야읍 도항리 718,35.2682938414678,128.40219640795
1060,전라남도 광양시 중마장애인복지관,전남 광양시 마동 1212,34.9381794893941,127.702602210206
1061,강원도 강릉시 화부산 경로당,강원 강릉시 교동 896-3,37.7603767221519,128.89181758601
1062,강원도 횡성군 안흥찐빵 모락모락마을,,,
1063,경기도 고양시 흙내음공원 화장실,,,
1064,경상남도 김해시 5호 어린이공원 화장실,,,
1065,경상남도 김해시 4호 어린이공원 화장실,,,
1066,충청남도 보령시 원도심 도시재생 어울림센터,,,
1067,경상남도 창원시 진동면 서촌1구 경로당,,,
1068,인천광역시 남동구 신월경로당,인천 남동구 구월동 1283-18,37.4496779569682,126.720130939879
1069,경기도 이천시 행복모아주식회사 제빵공장,,,
1070,경상남도 사천시 용현면 행정복지센터,경남 사천시 용현면 송지리 228-1,35.0134758514173,128.06136489179
1071,강원도 원주시 섬강중학교,강원 원주시 지정면 가곡리 461-2,37.376878673972,127.880739617107
1072,경기도 화성시 서해선 복선전철 106역사,,,
1073,경상남도 김해시 김해치매안심센터(동부건강생활지원센터),,,
1074,경상북도 칠곡군 북삼 제8어린이공원 공중화장실,,,
1075,충청남도 아산시 아산 배방공영(북수지구)주차타워 조성사업,,,
1076,충청남도 아산시 아산 배방공영(공수지구)주차타워 조성사업,,,
1077,충청남도 당진시 송악사회복지관,충남 당진시 송악읍 기지시리 411-15,36.9083345556737,126.691462147303
1078,경기도 안산시 월피체육문화센터,,,
1079,인천광역시 중구 중산7통경로당,,,
1080,경상북도 문경시 하늘재 옛길 복원 사업 (판매시설),,,
1081,경기도 안양시 비산2동 행정복지센터,경기 안양시 동안구 비산동 488-15,37.3998591534192,126.933620011911
1082,강원도 양양군 오색자연휴양체험지구 오색주차장1,,,
1083,충청남도 예산군 예산군 광시면 서초정보건진료소,충남 예산군 광시면 서초정리 1115-1,36.5749534744725,126.8153142099
1084,충청남도 홍성군 서부죽도 공중화장실,,,
1085,경상남도 하동군 지리산 국립공원 화개탐방 안내소,경남 하동군 화개면 용강리 423-4,35.2318055990397,127.641473281723
1086,경기도 성남시 성남수정경찰서 고등파출소,경기 성남시 수정구 고등동 587,37.4297656862203,127.100361422408
1087,충청북도 옥천군 국립해양측위정보원 청사,,,
1088,제주특별자치도 제주시 삼양 다목적체육관,제주특별자치도 제주시 도련이동 747,33.5134420901573,126.596462998301
1089,충청남도 계룡시 양정어린이공원 공중화장실,,,
1090,경상남도 창원시 교방남성경로당,경남 창원시 마산합포구 산호동 57-13,35.2170796940525,128.578033678935
1091,전라남도 해남군 우수영 5일시장 공중화장실,,,
1092,전라남도 목포시 송림근린공원 공중화장실,전남 목포시 용당동 1024-25,34.8097884111736,126.400911921216
1093,제주특별자치도 제주시 유수암 상동 경로당(증축공사),,,
1094,인천광역시 서구 불로문화체육센터 건립공사,,,
1095,강원도 고성군 해양심층수 산업지원센터,강원 고성군 죽왕면 오호리 253-6,38.3291836924128,128.51971771941
1096,전라북도 임실군 임실군립도서관,전북 임실군 임실읍 이도리 273-3,35.6148394511975,127.286437132106
1097,서울특별시 중랑구 망우리공원 웰컴센터,,,
1098,충청남도 당진시 정미면 주민다목적회관,,,
1099,서울특별시 서대문구 국립대한민국임시정부기념관 건립공사,,,
1100,경상남도 진주시 대봉새뜰센터,,,
1101,경기도 과천시 과천지식정보타운 지식기반산업용지 3BL (과천시 사회적경제 마을공동체 지원센터),,,
1102,부산광역시 연제구 연제구아이사랑뜰,,,
1103,전라남도 여수시 전라남도 여수시 장성지구 공영주차장,,,
1104,서울특별시 도봉구 생태문화도서관,,,
1105,경상남도 고성군 고성 송학동 고분군 화장실,,,
1106,인천광역시 서구 가재울마을 커뮤니티센터,인천 서구 가좌동 328-4,37.4882181394347,126.682233114525
1107,강원도 양구군 양구군 동면 청소년 문화의집 건립공사 설계용역,,,
1108,전라남도 여수시 여수시 장애인종합복지관 다동 재건축,,,
1109,서울특별시 동작구 사당지구대,서울 동작구 사당동 1028-1,37.4804886291055,126.979772397992
1110,경상북도 성주군 성주군 어린이놀이터(공중화장실),,,
1111,대구광역시 수성구 선수훈련시설 및 합숙소,,,
1112,서울특별시 구로구 구로창의문화예술센터 신축공사,,,
1113,경상남도 창원시 웅남동 경로당,경남 창원시 성산구 중앙동 51-16,35.2229793765012,128.674297128664
1114,강원도 삼척시 삼척항 어업인 편의시설,,,
1115,충청남도 아산시 (가칭)탕정2중학교 교사 신축공사,,,
1116,서울특별시 구로구 항동생활체육관,서울 구로구 항동 166-2,37.4772816119315,126.823274619726
1117,경기도 평택시 소사2유치원,,,
1118,전라남도 여수시 화정면 적금공원 공중화장실 신축공사,,,
1119,전라북도 남원시 오감만족 숲 화장실,,,
1120,전라남도 순천시 성동로타리지구 우수저류시설 공중화장실,,,
1121,충청남도 천안시 목천읍 소사리 경로당,충남 천안시 동남구 목천읍 소사리 126-7,36.734997452232,127.172140041609
1122,충청남도 천안시 광덕면 회개마을 경로당,,,
1123,경상북도 봉화군 봉화소방서,경북 봉화군 봉화읍 삼계리 164-2,36.9000601062016,128.735548653362
1124,전라남도 순천시 4차산업혁명 박람회장 공중화장실,,,
1125,충청남도 공주시 공주 원도심 청년센터 건립사업,,,
1126,경기도 하남시 풍산지구 내 멀티스포츠센터 건립공사,,,
1127,전라남도 영광군 법성뉴타운 공용주차장 화장실,,,
1128,전라남도 신안군 비금면 공립형 지역아동센터,,,
1129,충청남도 계룡시 계룡시 어린이감성체험장,충남 계룡시 엄사면 도곡리 151-6,36.2682087921709,127.214492489225
1130,충청남도 계룡시 공립 계룡상록어린이집,충남 계룡시 엄사면 도곡리 147-21,36.2684196000802,127.214028996828
1131,대전광역시 서구 노루벌 적십자 생태원,대전 서구 흑석동 697,36.2760673134078,127.33269064515
1132,경상북도 예천군 경북여성가족플라자,경북 예천군 호명면 금능리 775,36.5757969136149,128.471743954769
1133,경기도 화성시 어천역사,,,
1134,경기도 화성시 야목역사,,,
1135,제주특별자치도 서귀포시 오조리 종합복지회관,,,
1136,전라남도 나주시 청소차량 차고지 및 근무인력 대기실,,,
1137,경상남도 고성군 CGV 고성,경남 고성군 고성읍 서외리 77-1,34.9769281980733,128.315804695915
1138,전라북도 순창군 세계발효마을농장,,,
1139,경상북도 고령군 꿈꾸는 시간 여행자센터,,,
1140,경상북도 안동시 풍산읍 농업인상담소,경북 안동시 풍산읍 안교리 123-207,36.5786939068971,128.572547026874
1141,경상북도 울진군 포항~삼척 기성역사,,,
1142,경상북도 울진군 포항~삼척 울진역사,,,
1143,강원도 속초시 속초법무합동청사,,,
1144,경상남도 진주시 미천면 경로당,경남 진주시 미천면 효자리 581-2,35.3306380400435,128.068562538799
1145,경상북도 울진군 포항~삼척 죽변역사,,,
1146,강원도 삼척시 포항~삼척 임원역사,,,
1147,강원도 삼척시 포항~삼척 원덕역사,,,
1148,경상북도 울진군 포항~삼척 북면역사,,,
1149,강원도 삼척시 포항~삼척 매원역사,,,
1150,경상북도 울진군 포항~삼척 평해역사,,,
1151,경상북도 영덕군 포항~삼척 영해역사,,,
1152,경상북도 영덕군 포항~삼척 병곡역사,,,
